"pathway","pval","padj","log2err","ES","NES","size","leadingEdge"
"GOMF_PROTEIN_HOMODIMERIZATION_ACTIVITY",0.104602510460251,0.679098780780388,0.199915231309662,-0.206575057295163,-1.15171711326346,457,"Gyg1; Zbtb7b; Camk2b; Tenm3; Inpp5f; Grhpr; Syne1; Adam10; Hmox1; Bnip3l; Stat1; Zhx2; Hps4; Gale; Grpel1; Camk2g; Apoe; Rnf8; Jam3; Dars2; Card9; Abcb7; Pgrmc1; Tbx18; Mme; Rbpms2; Snx1; Cyp2r1; Erbb4; Cd247; Mtus2; Map3k11; G6pd2; Glud1; Kif20b; Smchd1; Snrpc; Slc25a27; Cda; Xkr4; Hand1; Cited1; Glce; Nudt16; Syt3; Pdlim4; Cidea; Axin1; Bcl10; Myh9; Pld6; Gstm7; Dck; Morc2b; Cenpf; Hsp90ab1; Dpyd; Trp53bp2; Abcb10; Pip4k2a; Pdk2; Mgat2; Fzd4; Lrrk2; Stub1; Birc5; Banf1; Srf; Tpm2; Acox1; Cisd2; Slc39a13; Tpm1; Psmd7; Gadd45a; Slc33a1; Psph; Pex7; Tsg101; Rack1; Kars1; Elavl1; Mid1; Col9a3; Trim8; Trim58; Prkra; Bhlhb9; Slc8b1; Zfp174; Cat; Iscu; Ccl5; Pip4k2b; Tsc2; Chuk; Gid8; Tpr; Wdr54; Exd2; Csf1; G6pdx; Lhpp; Tpd52; Ern1; Ppcs; St6gal1; Syt4; Nudt21"
"GOMF_PROTEOGLYCAN_BINDING",0.106261859582543,0.679098780780388,0.188204146308491,-0.423038710794771,-1.3816202681918,22,"Nid1; Apoe; Fst; Hpse; Sdcbp; Ctss; Pla2g2d; Chrd; Agrn; App"
"GOMF_RIBONUCLEOPROTEIN_COMPLEX_BINDING",0.091796875,0.679098780780388,0.206587922696891,-0.265507545358734,-1.25722310110895,122,"Itch; Dhx33; Prmt5; Snrpn; Prmt3; Rpsa; Usp16; Prmt1; Eri1; Tmem147; Tma16; Cimap2; Snrpc; Nmd3; C1qbp; Tmem223; Mettl17; Cbx5; Eefsec; Stau2; Pqbp1; Rack1; Zfp622; Derl1; Ung; Efl1; Timm50; Snrpd2; Maip1; Eif1b; Guf1; Nolc1; Csnk2a1; Mtor; Prmt7; Sbds; Derl2; Eif6; Secisbp2; Cd2bp2; Ago2; Fmr1; Prpf6; Ppp1ca; Pttg1; Snrpe; Rictor; Sec61b; Cpeb3; Mdm2; Rplp1rt; Secisbp2l; Afg2b; Snd1"
"GOMF_R_SMAD_BINDING",0.102362204724409,0.679098780780388,0.195789002148949,-0.475179486081806,-1.38128986987017,16,"Ldlrad4; Men1; Smad2; Axin1; Stub1; Zeb2; Jun"
"GOMF_UBIQUITIN_LIKE_PROTEIN_CONJUGATING_ENZYME_ACTIVITY",0.0988372093023256,0.679098780780388,0.197822021315103,-0.386400310644304,-1.3733774233117,31,"Ube2l3; Atg10; Ube2d4; Taf1; Ube2i; Ube2a; Ube2d3; Ube2q2l; Ube2q1; Ube2s; Ube2o; Ube2e2; Ube2q2; Ube2v1"
"GOMF_NEUTRAL_L_AMINO_ACID_TRANSMEMBRANE_TRANSPORTER_ACTIVITY",0.111570247933884,0.690319865319865,0.191892240384838,0.379141996656488,1.30500913278802,27,"Slc6a20a; Slc38a2; Slc1a5; Slc6a18; Slc1a3; Slc25a12; Slc32a1"
"GOMF_PEPTIDASE_ACTIVATOR_ACTIVITY",0.111742424242424,0.690319865319865,0.183023938384487,-0.355008353731354,-1.32354911158542,39,"Ctsh; Apaf1; Psme2; Rps27l; Bcl10; Acrbp; Cflar; Lgmn; Rack1; Cav1; Timm50; Aph1c; Ctss"
"GOMF_UBIQUITIN_CONJUGATING_ENZYME_ACTIVITY",0.109404990403071,0.690319865319865,0.186432558434075,-0.40114098815663,-1.35768302902569,26,"Ube2l3; Ube2d4; Taf1; Ube2a; Ube2d3; Ube2q2l; Ube2q1; Ube2s; Ube2o; Ube2e2; Ube2q2; Ube2v1"
"GOMF_CARBON_OXYGEN_LYASE_ACTIVITY",0.119318181818182,0.721096837944664,0.176694268938498,-0.339320598346466,-1.30678859179577,44,"Echs1; Poll; Ogg1; Alad; Hacd3; Xrcc6; Car5b; Thnsl2; Pts; Tbxas1; Hmbs; Rps3; Ireb2; Pcbd2; Apip; Echdc3; Eno1; Aco1; Cyp1b1; Naxd; Tpi1"
"GOMF_VITAMIN_BINDING",0.118867924528302,0.721096837944664,0.176694268938498,-0.284108002994688,-1.23779789631921,81,"Gpt2; Oat; Folr1; Sgpl1; Sptlc2; Slc46a1; Cyp2r1; Egln1; Rbp7; Thnsl2; Rho; Plpbp; Akr1b8; Ggcx; Alas2; Acacb; Cth; Opn3; Sardh; Psat1; Ogfod3; Rbp1"
"GOMF_EPHRIN_RECEPTOR_BINDING",0.122105263157895,0.729540958456135,0.184706471207739,0.413325176631896,1.32375978992716,22,"Abl1; Efnb3; Chn1; Fyn; Grb2; Cdk5"
"GOMF_GDP_BINDING",0.123339658444023,0.729540958456135,0.173747838999571,-0.303933890442812,-1.26402681502205,61,"Prps2; Rras2; Rab11b; Ran; Rap2c; Diras1; Rala; Suclg2; Arl3; Rab14; Rab18; Rab5b; Dync1li1; Eif2b1; Rab40c; Rab9; Rap2a; Gm266; Rhoa; Gnai1; Rap2b; Rerg; Rab28"
"GOMF_G_PROTEIN_ACTIVITY",0.13102119460501,0.766818781056688,0.169570644405628,-0.358853624052885,-1.30222495746599,34,"Rab1b; Rab11b; Ran; Rap2c; Rala; Rab5b; Rab11a; Rap2a; Rhoa; Sar1a; Rap2b; Cdc42; Rerg"
"GOMF_OXIDOREDUCTASE_ACTIVITY",0.134765625,0.780517578125,0.16823816568964,0.202777671972648,1.1267773988101,403,"Aass; Aox3; Prdx3; Hadh; Aldh3b2; Aoc1; Tet3; Cyp2f2; Fa2h; L2hgdh; Ndufs8; Cyb561d1; Snca; Retsat; Aldh6a1; Hsd11b2; Aldh2; Dhrs7b; Phgdh; Jmjd1c; Idh1; Prodh; Cyp11b2; Aldh1a1; Iyd; Pam; Loxl4; Peds1; Ugdh; Cyp2d9; Cyb5r3; Mical3; Aldh9a1; Cyp2d40; Hsd17b12; Acad9; Akr1d1; Cyp2c29; Oxnad1; Cyp2c23; Aldh18a1; Dhrs7c; Sdr39u1; Mgst1; Hpdl; Cyp2d26; Haao; Mical1; Plod3; Akr1cl; P3h2; Spr; Pdhx; Phyh; Ndufv2; Crym; Asphd1; Qdpr; Cyp19a1; Aifm2; Vat1; Gstk1; Rrm1; Ldhal6b; Enox2; Pxdn; Hsd3b6; Steap1; Degs1; Hsd3b3; Sdhb; Aldh1b1; Cox6a2; Rtn4ip1; Cox6a1; Cyp26c1; Ldhb; Rdh14; Mthfd2; Aldh1a3; Rdh8; Suox; Plod1; Cyp4f18; Tecr; Uevld; Dhrs3; Fmo5"
"GOMF_TRANSPORTER_REGULATOR_ACTIVITY",0.136186770428016,0.780616952144089,0.166933848713193,-0.269302581817052,-1.19631051558193,91,"Lrg1; Stim1; Sgk2; Kcne2; Wnk1; Pcsk9; Lrrc52; Stimate; Pdzd11; Nedd4; Arpp19; Nrxn3; Sgk1; Agt; Fgf12; Atp6ap1; Fxyd1; Tmprss3"
"GOMF_CELL_ADHESION_MEDIATOR_ACTIVITY",0.139059304703476,0.784246198937534,0.169570644405628,0.357409278541502,1.25274616548501,28,"Itga11; Cxadr; Dscaml1; Tmigd1; Ager; Bcam; Cd200; Igsf9; Sirpa; Ntng1"
"GOMF_CHEMOKINE_ACTIVITY",0.142259414225941,0.784246198937534,0.169570644405628,0.43859655702146,1.30480744835535,17,"Ccl28; Ccl17; Cxcl11; Pf4; Cxcl3; Cxcl12; Ccl22"
"GOMF_CYTOKINE_RECEPTOR_ACTIVITY",0.144067796610169,0.784246198937534,0.169570644405628,0.326860304221387,1.26005681443841,43,"Il9r; Il17rc; Il10rb; Ifnar2; Cntfr; Gpr35; Il4ra; Ifngr1; Il2ra; Flt3; Osmr; Il12rb1; Ifngr2; Il20rb; Il17rd; Il27ra; Il6ra"
"GOMF_EPIDERMAL_GROWTH_FACTOR_RECEPTOR_BINDING",0.149514563106796,0.784246198937534,0.158514105424824,-0.43368747694858,-1.32064819243125,18,"Snx1; Erbb4; Efemp1; Socs5; Hbegf; Fer; Egf; Shc1; Tgfa"
"GOMF_IMMUNE_RECEPTOR_ACTIVITY",0.146997929606625,0.784246198937534,0.165656695205483,0.300059329220371,1.24004217440426,55,"Il9r; Il17rc; Il10rb; Ifnar2; Fcgr2b; Cmklr1; Cntfr; Gpr35; Il4ra; Ifngr1; C5ar2; Il2ra; Flt3; Osmr; Il12rb1; Ifngr2; Il20rb; Il17rd; Il27ra; Il6ra"
"GOMF_PHOSPHATIDYLINOSITOL_3_PHOSPHATE_BINDING",0.141472868217054,0.784246198937534,0.163180127180689,-0.393921450857302,-1.28643682741245,23,"Sestd1; Sap30l; Atg2a; Atg2b; Snx12; Jph2; Sh3pxd2a; Tecpr1; Zfyve1; Vps36"
"GOMF_SPECTRIN_BINDING",0.145833333333333,0.784246198937534,0.166933848713193,0.423214354125316,1.30748774384957,19,"Ank3; Camsap1; Ank2; Epb41; Dmtn; Unc13a; Ank1; Epb41l2"
"GOMF_T_CELL_RECEPTOR_BINDING",0.145748987854251,0.784246198937534,0.16440575583821,0.449764907769604,1.32652300594855,16,"H2-T23; Lck; Fyn; H2-Q1; H2-Q4; H2-K1"
"GOMF_VOLTAGE_GATED_CALCIUM_CHANNEL_ACTIVITY",0.148979591836735,0.784246198937534,0.163180127180689,0.384657935183736,1.27808322650046,24,"Cacna1a; Cacng4; Cacna1d; Htr1b; Catsper4; Itgav; Tpcn2; Cacnb3; Cacng7; Cacnb4; Cacna1i"
"GOMF_TUMOR_NECROSIS_FACTOR_RECEPTOR_BINDING",0.151574803149606,0.787622341599823,0.158514105424824,-0.452891845585227,-1.31650236758323,16,"Siva1; Stat1; Tnfsf11"
"GOMF_DNA_ENDONUCLEASE_ACTIVITY",0.157894736842105,0.800720072007201,0.154190966581424,-0.370520215209295,-1.27332542715054,28,"Dclre1c; Eme1; Mus81; Exog; Aplf"
"GOMF_MONOATOMIC_ION_TRANSMEMBRANE_TRANSPORTER_ACTIVITY",0.158415841584158,0.800720072007201,0.155241966228839,0.202157557701396,1.10949123332456,363,"P2rx5; Trpm7; Kcna2; Clcnkb; Asic2; Atp2b4; Sfxn4; Cacna1a; Slc6a20a; Ndufs8; Slc19a1; Cftr; Kcnb2; Atp1b2; Asic4; Slc9a5; Kcnq1; Slc30a6; Kcnk2; Slc38a2; Sec61a1; Slc41a2; Cacng4; Chrnb4; Slc6a18; Cacna1d; Cngb3; Htr1b; Kcnk13; Slc34a3; Slc1a3; Pkd1l3; Slc24a1; Slc25a12; Kcnh6; Kcnj6; Slc15a4; Kcnc2; Slc39a7; Slc5a2; Scn8a; Slc32a1; Slc9c1; Gabre; Catsper4; Slc5a5; Sfxn3; Cngb1; Abcc8; Asic5; Ryr3; Ano2; Slc6a11; Ndufv2; Scn5a; Itgav; Trpm4; Clic1; Slc47a2; Tpcn2; Slc36a3; Gjd3; Trpv1; Nalf1; Atp5pf; Pkdrej; Atp1a2; Slc9a1; Slc39a8; P2rx3; Grin3b; Slc25a22; Tmem120a; Grin2d; Slc39a4; Lasp1; Atp5po; Ttyh3; Clcn7; Scn7a; Slc34a1; Grik4; Kcnma1; Kcnmb2"
"GOMF_N_ACYLTRANSFERASE_ACTIVITY",0.156899810964083,0.800720072007201,0.152144922367565,-0.308519334579705,-1.22711177170323,52,"Sat1; Hgsnat; Naa30; Naa50; Ncoa3; Gnpnat1; Taf1; Kat14; Nags"
"GOMF_AMINO_ACID_MONOATOMIC_CATION_SYMPORTER_ACTIVITY",0.160569105691057,0.804201463624623,0.156312403073186,0.4546239163502,1.30541018583175,15,"Slc6a20a; Slc38a2; Slc6a18; Slc1a3; Slc6a11; Slc36a3; Slc25a22; Slc38a1; Slc6a6; Slc6a1"
"GOMF_CATALYTIC_ACTIVITY_ACTING_ON_RNA",0.166336633663366,0.804201463624623,0.151148761385484,-0.220090103455921,-1.13405205064594,236,"Mblac1; Polr3a; Dhx33; Ddx52; Pop4; Prorp; Zcwpw2; Tsr3; Ddx46; Exog; Prim1; Eri1; Dars2; Ddx27; Fbl; Mettl5; Ddx21; Iars2; Mettl16; Nudt16; Tsnax; Vars1; Ddx10; Nsun3; Dis3l; Pld6; Ythdc2; Ankzf1; Tdp2; Nsun5; Xrn2; Ddx3y; Trmt12; Trmt10a; Polr3b; Dus2; Lars1; Ddx54; Thg1l; Ftsj1; Trmt44; Tdrd12; Kars1; Dhx37; Mettl3; Rigi; Rpp14; Lactb2; Fen1; Dus4l; Mettl1; Exd2; Mrm1; Rnaseh1; Polr2j; Ern1; Mars2; Tars1; Aars1; Tyw1; Trmt10b; Rnasek; Jmjd6; Pus3; Dbr1; Cars2; Ddx50; Ggt5; Cmtr2; Dhx57; Ptrh2"
"GOMF_METHYLATION_DEPENDENT_PROTEIN_BINDING",0.165692007797271,0.804201463624623,0.150169802128406,-0.312093793703227,-1.21732215733703,48,"Cbx3; Rrp8; Zcwpw2; Lrwd1; Ttll12; Zmynd11; Taf1"
"GOMF_POTASSIUM_CHANNEL_REGULATOR_ACTIVITY",0.165703275529865,0.804201463624623,0.149207542435322,-0.349753383059223,-1.26920157370561,34,"Lrg1; Sgk2; Kcne2; Wnk1; Lrrc52; Arpp19; Sgk1"
"GOMF_PROTEASE_BINDING",0.165067178502879,0.804201463624623,0.149207542435322,-0.259563160802002,-1.17974055488082,99,"Stim1; Nos1ap; Itgb1; Chmp3; Sri; Slc2a13; Xiap; Ccbe1; Atp9a; Timp3; Cast; Trip4; Bcl10; Lonp2; Ins1; Ndufs7; Mif; Cflar; Ddt; Flot1; Derl1; Lcor; Hdac3; Twnk; Ldlr; Serpinb6b"
"GOMF_ATPASE_BINDING",0.176136363636364,0.81974358974359,0.142901149386948,-0.288637957286808,-1.18074287165221,58,"Atp5if1; Pih1d1; Grpel1; Bbc3; Fbl; Slc2a13; Abca1; Rab6a; Fxyd1; Rala; Fxyd4; Atp6v0a2; Cav1; Derl1; Tcirg1; Dnajb1"
"GOMF_CARBOHYDRATE_TRANSMEMBRANE_TRANSPORTER_ACTIVITY",0.176356589147287,0.81974358974359,0.144630528034484,-0.404358976631799,-1.27223365749899,20,"Slc45a3; Slc50a1; Abcb11; Slc2a4; Aqp7; Aqp2; Slc23a1; Mfsd4a; Tmem144"
"GOMF_EXOPEPTIDASE_ACTIVITY",0.176923076923077,0.81974358974359,0.143758989039275,-0.297496404988168,-1.18826753499563,54,"Folh1; Ctsh; Adam10; Mme; Cpvl; Nudt16; Lta4h; Mindy2"
"GOMF_GLUTAMATE_RECEPTOR_BINDING",0.172631578947368,0.81974358974359,0.153158808683073,0.305601569813412,1.22417185678771,49,"Shisa7; Igsf11; Rasgrf1; Cacng4; Fyn; Canx; Dlg2; Shank2; Homer3"
"GOMF_SINGLE_STRANDED_DNA_BINDING",0.173447537473233,0.81974358974359,0.154190966581424,0.272524757694849,1.20283808169539,83,"Terf1; Smc4; Pot1a; Dmc1; Rad51d; Aptx; Rad51b; Hmces; Hsf1; Anxa1; Mcm3; Setmar; Pms2; Spen; Meiob; Pot1b; Nabp2; Fbh1; Hmgb1; Msh2; Neil3; Ybx1; Ercc4; Lonp1; Top1; Nucks1; Ssbp2"
"GOMF_3_5_EXONUCLEASE_ACTIVITY",0.205426356589147,0.829805709323782,0.132846300606183,-0.349353739495843,-1.23145995596102,30,"Exd1; Aplf; Eri1; Rad9a; Dis3l; Xrn2; Trir; Rad50; Exd2"
"GOMF_ACYLTRANSFERASE_ACTIVITY",0.210633946830266,0.829805709323782,0.135002033828631,-0.19842592217794,-1.09384608792639,399,"Itch; Gpat3; Ube2l3; Sat1; Hgsnat; Rnf148; Nfx1; Zdhhc13; Osgep; Naa30; Naa50; Rnf146; Trim14; Ncoa3; Med17; Acat2; Atg10; Gnpnat1; Zdhhc16; Rnf8; Acat1; Sptlc2; Ube2d4; Taf1; Cbll1; Fbxo11; Rnf170; Xiap; Nedd4; Kat14; Tnfaip1; Cop1; Trim7; Fbxo44; Nags; Atg12; Med31; Kcmf1; Sh3rf3; Agpat5; Acaa2; Elovl6; Fbxo15; Skp1; Mboat7; Fbxl3; Siah1b; Smurf2; Dtx2; Rnf128; Stub1; Birc5; Lrsam1; Ube2i; Wsb1; Maea; Mcat; Ube2a; Elovl1; Aspg; Cln5; Ube2d3; Rnf169; Birc3; Slc27a3; Glul; Ppp1r11; Mul1; Sh3rf1; Alas2; Zdhhc17; Ube2q2l; Zdhhc23; Trim8; Trim58; Acat3; Clock; Marchf4; F13a1; Rnf223; Trim62; Peli3; Peli2; Siah2; Ube2q1; Rnf227; Fbxo6; Cs; Ube2s; Zdhhc7; Fbxw11; Cdc42; Jade2; Hectd3; Rad18; Taf10"
"GOMF_AMINO_ACID_TRANSMEMBRANE_TRANSPORTER_ACTIVITY",0.188796680497925,0.829805709323782,0.144630528034484,0.292704266376232,1.20730807984257,54,"Slc6a20a; Slc22a4; Slc38a10; Slc38a2; Slc1a5; Slc6a18; Slc1a3; Slc25a12; Slc15a4; Slc32a1; Sfxn3; Slc6a11; Slc47a2; Slc36a3; Grin3b; Slc25a22; Grin2d"
"GOMF_ATP_DEPENDENT_ACTIVITY",0.191532258064516,0.829805709323782,0.141225119642531,-0.203274978449894,-1.10316189225771,358,"Dhx33; Ddx52; Atf7ip; Atp6v0e2; Btaf1; Nav2; Zcwpw2; Myo6; Ddx46; Acsbg1; Ino80; Kif27; Acsl4; Smarca1; Myh7; Ddx27; Abcb7; Abca1; Abcb8; Sae1; Smc2; Ddx21; Nae1; Myh11; Myo9a; Kif20b; Atp9a; Smchd1; Atp5pb; Swsap1; Atp8a1; Nubp1; Smarca5; Ddx10; Kif4; Myh9; Lonp2; Spo11; Entpd2; Ercc3; Msh4; Ythdc2; Morc2b; Mlh1; Hsp90ab1; Xrcc6; Slc27a6; Abcb10; Abca5; Atp10b; Atp6v0e; Ddx3y; Smarca2; Hfm1; Atp6v0a2; Uba1y; Atp5f1e; Aacs; Uba6; Abcb11; Kif13b; Atp2b2; Chd4; Dync1li1; Ddx54; Slc27a3; Psmc4; Atp6v1b2; Nubp2; Myh10; Tdrd12; Shoc1; Ddx11; Kif3b; Anxa5; Dhx37; Atp5mg; Atp11c; Rfc2; Mcm5; Npm2; Rigi; Rad50; 2310057M21Rik; Smc6; Uba2; Atp10d; Twnk; Dscc1; Msh5"
"GOMF_ATP_DEPENDENT_ACTIVITY_ACTING_ON_DNA",0.198473282442748,0.829805709323782,0.134273452883202,-0.271817282285361,-1.15852943513163,70,"Btaf1; Nav2; Ino80; Smarca1; Smarca5; Spo11; Ercc3; Msh4; Mlh1; Xrcc6; Smarca2; Hfm1; Chd4; Ddx11; Rfc2; Mcm5; Npm2; Rad50; Twnk; Dscc1; Msh5; Ruvbl1; Top2b; Rbbp4"
"GOMF_CULLIN_FAMILY_PROTEIN_BINDING",0.201941747572816,0.829805709323782,0.134273452883202,-0.406300299835615,-1.23724982869588,18,"Kctd2; Kctd9; Skp1; Dcun1d2; Klhl36; Dcun1d1; Tes3-ps; Kctd17"
"GOMF_CYSTEINE_TYPE_ENDOPEPTIDASE_REGULATOR_ACTIVITY_INVOLVED_IN_APOPTOTIC_PROCESS",0.193857965451056,0.829805709323782,0.136490437780413,-0.355754340979298,-1.20406950551066,26,"Ctsh; Apaf1; Rps27l; Xiap; Bcl10; Rps6ka3; Birc5; Gas6; Birc3; Rack1; Ctss; Dpep1"
"GOMF_DNA_NUCLEASE_ACTIVITY",0.209039548022599,0.829805709323782,0.129442887745046,-0.31830621767081,-1.20981944273719,42,"Dclre1c; Eme1; Mus81; Exog; Aplf; Rad9a; Pld3"
"GOMF_ELECTRON_TRANSFER_ACTIVITY",0.21747572815534,0.829805709323782,0.128788713061714,-0.338615714951687,-1.20917874486512,32,"Etfa; Ndufa2; Acadsb; Por; Ndufs7; Aifm1; Ndufs3; Ndufs2; Uqcrfs1; Etfb; Aox4; Fdx1; mt-Co2; Steap4; Ndufb7; Ndufs1"
"GOMF_ENDOPEPTIDASE_REGULATOR_ACTIVITY",0.218146718146718,0.829805709323782,0.128142916898415,-0.253519650065396,-1.1279200020795,90,"Serpini1; Psme2; Wfikkn2; Cst8; Tfpi2; Xiap; Itih2; Timp3; Cast; Cstdc1; Tfpi; Wfdc5; Lxn; Wfdc17; Birc5; Spink4; Lgmn; Cst9; Wfdc3; Rarres1; Wfdc1; Timm50; Aph1c; Serpinb6b; Rock1; Eppin; Crim1"
"GOMF_EXONUCLEASE_ACTIVITY_ACTIVE_WITH_EITHER_RIBO_OR_DEOXYRIBONUCLEIC_ACIDS_AND_PRODUCING_5_PHOSPHOMONOESTERS",0.193359375,0.829805709323782,0.138022242496643,-0.340627071162683,-1.22176635392822,33,"Dclre1c; Eri1; Rad9a; Pld3; Dis3l; Dclre1a; Xrn2"
"GOMF_EXTRACELLULAR_MATRIX_BINDING",0.218216318785579,0.829805709323782,0.126875729929857,-0.298404531691675,-1.17193826416584,49,"Spock2; Itgb1; Rpsa; Nid1; Adamtsl2; Ccn1; Adam9; Adamts5"
"GOMF_FATTY_ACID_BINDING",0.206896551724138,0.829805709323782,0.131457611642763,-0.360128931940685,-1.20385278465299,25,"Apoc1; Ffar4; Gstm7; Rbp7; Insr; Acox1; Rbp1; Prr7; Arhgdia; Adh5; Scp2"
"GOMF_GTPASE_ACTIVITY",0.191146881287726,0.829805709323782,0.141225119642531,-0.232610364196181,-1.14894140626435,166,"Rab36; Rab1b; Rras2; Rab11b; Eif2s3x; Rasd1; Ran; Zng1; Rap2c; Rab6a; Gspt2; Diras1; Septin6; Bms1; 1700009N14Rik; Rab30; Rala; Arl3; Rab14; Gng2; Lrrk2; Gtpbp10; Eefsec; Rab18; Tufm; Tubb6; Rab5b; Septin7; Arl6; Rab11a; Nkiras1; Rab40c; Gng4; Drg2; Arl15; Rab9; Rap2a; Ift27; Gm266; Efl1; Rhoa; Arl5a; Sar1a; Gnai1; Rap2b; Cdc42; Rasl2-9; Gnl1; Rerg; Adss1; Rab28; Guf1"
"GOMF_GUANYL_RIBONUCLEOTIDE_BINDING",0.220883534136546,0.829805709323782,0.130105630751129,-0.21766145472328,-1.11185995250786,223,"Prps2; Rab36; Rab1b; Ak4; Rras2; Rab11b; Eif2s3x; Rasd1; Tube1; Ran; Samhd1; Zng1; Rap2c; Rab6a; Glud1; Gspt2; Diras1; Septin6; Bms1; Rab30; Hsp90ab1; Gnl3l; Rala; Suclg2; Arl3; Rab14; Insr; Lrrk2; Gtpbp10; Eefsec; Rab18; Tufm; Tubb6; Rab5b; Ehd1; Septin7; Arl6; Dync1li1; Rab11a; Thg1l; Eif2b1; Nkiras1; Rab40c; Ehd4; Drg2; Arl15; Rab9; Rap2a; Ift27; Gm266; Rigi; Pip4k2b; Efl1; Rhoa; Arl5a; Sar1a; Npr2; Gnai1; Noa1; Rap2b; Cdc42; Rasl2-9; Gnl1; Rerg; Adss1; Rab28; Guf1"
"GOMF_IONOTROPIC_GLUTAMATE_RECEPTOR_BINDING",0.209876543209877,0.829805709323782,0.135740943810425,0.336537420775348,1.19848582976625,30,"Shisa7; Igsf11; Cacng4; Canx; Dlg2; Shank2; Gripap1"
"GOMF_ISOMERASE_ACTIVITY",0.197628458498024,0.829805709323782,0.137250779610133,-0.247544114842322,-1.1455888209841,112,"Pbld2; Echs1; Pgm3; Gale; Ebp; Pgam1; Ppib; Dkc1; Glce; Rpusd4; Ebpl; Spo11; Ppie; Yjefn3; Mif; Fkbp7; Ddt; Tbxas1; Txndc5; Ppig; Creld1; Rpusd1; Twnk; Pdia4; Erp27; Tmx1; Top2b; Tmx3; Pus3; Ptges3; Lss; Fkbp1a; Fkbp10; Top3a; Pin1; Thap4; Tpi1; Hyi"
"GOMF_LIGASE_ACTIVITY_FORMING_CARBON_SULFUR_BONDS",0.196881091617934,0.829805709323782,0.136490437780413,-0.35526615797372,-1.22090351291221,28,"Acsbg1; Acsl4; Sae1; Nae1; Slc27a6; Suclg2; Uba1y; Aacs; Uba6; Slc27a3"
"GOMF_METHYL_CPG_BINDING",0.215686274509804,0.829805709323782,0.130105630751129,-0.433837167465222,-1.23413793864544,15,"Prmt5; Zbtb33; Prmt1; Lrwd1"
"GOMF_MONOATOMIC_CATION_TRANSMEMBRANE_TRANSPORTER_ACTIVITY",0.201980198019802,0.829805709323782,0.135740943810425,0.205169341071215,1.10204960294333,306,"P2rx5; Trpm7; Kcna2; Asic2; Atp2b4; Cacna1a; Slc6a20a; Ndufs8; Kcnb2; Atp1b2; Asic4; Slc9a5; Kcnq1; Slc30a6; Kcnk2; Slc38a2; Sec61a1; Slc41a2; Cacng4; Chrnb4; Slc6a18; Cacna1d; Cngb3; Htr1b; Kcnk13; Slc34a3; Slc1a3; Pkd1l3; Slc24a1; Slc25a12; Kcnh6; Kcnj6; Slc15a4; Kcnc2; Slc39a7; Slc5a2; Scn8a; Slc32a1; Slc9c1; Catsper4; Slc5a5; Cngb1; Abcc8; Asic5; Ryr3; Slc6a11; Ndufv2; Scn5a; Itgav; Trpm4; Slc47a2; Tpcn2; Slc36a3; Trpv1; Nalf1; Atp5pf; Pkdrej; Atp1a2; Slc9a1; Slc39a8; P2rx3; Grin3b"
"GOMF_NEUROPEPTIDE_ACTIVITY",0.188976377952756,0.829805709323782,0.140406238523342,-0.431749749774484,-1.25504482653488,16,"Qrfp; Ghrh; Npff; Pyy; Npy; a; Cartpt"
"GOMF_OUTWARD_RECTIFIER_POTASSIUM_CHANNEL_ACTIVITY",0.184210526315789,0.829805709323782,0.144630528034484,0.433861086679063,1.2796167573848,16,"Kcna2; Kcnq1; Kcnk2; Kcnk13"
"GOMF_OXIDOREDUCTASE_ACTIVITY_ACTING_ON_PAIRED_DONORS_WITH_INCORPORATION_OR_REDUCTION_OF_MOLECULAR_OXYGEN_REDUCED_FLAVIN_OR_FLAVOPROTEIN_AS_ONE_DONOR_AND_INCORPORATION_OF_ONE_ATOM_OF_OXYGEN",0.190965092402464,0.829805709323782,0.142901149386948,0.414643224103943,1.25689014251812,18,"Cyp2f2; Cyp2d9; Cyp2c29; Cyp2c23; Cyp2d26; Cyp19a1; Cyp26c1; Cyp4f18"
"GOMF_PROTEIN_KINASE_C_BINDING",0.216318785578748,0.829805709323782,0.127505315300183,-0.318382291404054,-1.19325084136885,40,"Add3; Adam9; Src; Glrx3; C1qbp; Copb2; Prkcsh; Pawr; Marcks; Ldb3; Rack1; Srsf2; Cask"
"GOMF_RNA_POLYMERASE_BINDING",0.216981132075472,0.829805709323782,0.126875729929857,-0.313454530599534,-1.19735003171267,43,"Maf1; Ncoa3; Polr2m; Nedd4; Ppib; Zfp36; Ythdc2; Uri1"
"GOMF_RNA_POLYMERASE_II_CORE_PROMOTER_SEQUENCE_SPECIFIC_DNA_BINDING",0.213725490196078,0.829805709323782,0.130777137971974,-0.435239694637927,-1.23812771205266,15,"Stat1; Taf1; Hdac1; H2az1; Gbx2"
"GOMF_UDP_GLYCOSYLTRANSFERASE_ACTIVITY",0.220833333333333,0.829805709323782,0.132846300606183,0.263079510747536,1.1415177094795,68,"Csgalnact2; Mgat4b; Mgat3; A3galt2; Extl1; Chsy1; Rfng; B4galt7; Uggt1; Plod3; Poglut1; Pomgnt1; B4galt6; Galnt15; B3gnt3; Cercam; B3gat1; Gbgt1"
"GOMF_VOLTAGE_GATED_MONOATOMIC_CATION_CHANNEL_ACTIVITY",0.2,0.829805709323782,0.140406238523342,0.26978474979743,1.17061214218541,68,"Kcna2; Cacna1a; Kcnb2; Kcnq1; Kcnk2; Cacng4; Cacna1d; Htr1b; Kcnk13; Kcnh6; Kcnj6; Kcnc2; Catsper4; Itgav; Tpcn2; Grin2d; Kcnma1; Lrrc26; Lrrc55; Kcnj11; Kcns3; Cacnb3; Cacng7; Cacnb4; Cacna1i"
"GOMF_LIPID_TRANSFER_ACTIVITY",0.226666666666667,0.840177777777778,0.124434168630393,-0.325494093314229,-1.19006557916683,36,"Star; Apoe; Prelid1; Atg2a; Abca1; Pitpnb; Cidea; Atg2b; Stard4; Osbpl8"
"GOMF_TELOMERIC_DNA_BINDING",0.226530612244898,0.840177777777778,0.129442887745046,0.356523655970426,1.18460289745165,24,"Hmbox1; Smg6; Terf1; Pot1a"
"GOMF_SH2_DOMAIN_BINDING",0.228395061728395,0.840977843185349,0.129442887745046,0.331347786229954,1.16703155223746,29,"Abl1; Syp; Lat2; Lck"
"GOMF_LAMININ_BINDING",0.235294117647059,0.860681114551084,0.121543282035469,-0.361973533866097,-1.18218488799487,22,"Itgb1; Rpsa; Nid1; Adam9"
"GOMF_CELL_CELL_ADHESION_MEDIATOR_ACTIVITY",0.240246406570842,0.873052301002537,0.12563992130984,0.39723580242571,1.2041237750915,18,"Cxadr; Dscaml1; Tmigd1; Cd200; Igsf9; Sirpa; Ntng1"
"GOMF_HYDROLASE_ACTIVITY_ACTING_ON_CARBON_NITROGEN_BUT_NOT_PEPTIDE_BONDS",0.246653919694073,0.884771479676803,0.118815039412263,-0.248653298554225,-1.10397802097963,89,"Asah1; Agmat; Aga; Hint3; Ngly1; Fhit; Cda; Dclre1a; Klk1b21; Mier2; Klk1b22; Aspg; Asah2; Hdac1; Gda; Ndst3; Cat; Ndst2; Hdac3; Hdac2; Dpep1; Klk1b4; Zbp1"
"GOMF_LIPID_TRANSMEMBRANE_TRANSPORTER_ACTIVITY",0.245322245322245,0.884771479676803,0.125033367555272,0.373784048900582,1.19222981661299,21,"Abcd1; Slco2a1; Slc27a4"
"GOMF_LIPID_TRANSPORTER_ACTIVITY",0.249034749034749,0.887585387585388,0.118815039412263,-0.24924931748614,-1.10892110581867,90,"Star; Apoe; Prelid1; Atg2a; Abca1; Atp9a; Pitpnb; Xkr4; Atp8a1; Cidea; Atg2b; Slc27a6; Plscr3; Abca5; Atp10b; Ano7; Ano5; Abcb11; Stard4; Osbpl8; Atp11c; Ano10; Atp10d; Cptp; Slc10a7; Apob; Tmem41b; Plscr1l1; Xkr8; Apoa2; Slc2a1; Triap1; Abcb1a; Scp2; Slco1a4"
"GOMF_CYTOKINE_ACTIVITY",0.256959314775161,0.904236576044236,0.12384217120105,0.253648219121226,1.11952301102438,83,"Ccl28; Il24; Wnt3; Bmp3; Gdf10; Wnt10b; Ifnl2; Il17a; Wnt11; Aimp1; Ccl17; Vegfa; Bmp7; Hmgb1; Ctf2; Wnt3a; Cxcl11; Pf4; Pglyrp1; Slurp1; Il17d; Il1rn; Il17c; Cxcl3; Il27; Cxcl12; Tafa5; Ccl22; 6030468B19Rik; Wnt9a"
"GOMF_MICROTUBULE_MOTOR_ACTIVITY",0.255578093306288,0.904236576044236,0.120433371642259,0.286533955694526,1.13854248494909,47,"Kif19a; Cenpe; Kif11; Kif18b; Dnah3; Kif1b; Kif17; Kifc2; Kif2a; Kif6; Dnai2; Dnah7b; Kif21b; Dnah12; Kif21a; Kifc3"
"GOMF_CYSTEINE_TYPE_ENDOPEPTIDASE_INHIBITOR_ACTIVITY",0.27843137254902,0.920175020970777,0.112378519110475,-0.406096856192235,-1.15522498895085,15,"Cst8; Cast; Cstdc1; Birc5; Cst9"
"GOMF_HEXOSYLTRANSFERASE_ACTIVITY",0.272727272727273,0.920175020970777,0.117249716749792,0.241836414894255,1.10986621499922,95,"Csgalnact2; Mgat4b; Mgat3; A3galt2; Extl1; Chsy1; Tmtc4; Fut11; Rfng; Sec1; B4galt7; Tmtc3; Uggt1; Plod3; Poglut1; Pomgnt1; B4galt6; Galnt15; B3gnt3; Pygm; Cercam; B3gat1; Gbgt1; Alg9"
"GOMF_HYDROLASE_ACTIVITY_ACTING_ON_CARBON_NITROGEN_BUT_NOT_PEPTIDE_BONDS_IN_CYCLIC_AMIDINES",0.281376518218623,0.920175020970777,0.11378726182188,0.388506125955421,1.14584820898434,16,"Adat2; Atic; Ampd1; Apobec3; Mthfd2; Adad2; Mthfd2l; Ada; Lacc1"
"GOMF_MODIFIED_AMINO_ACID_TRANSMEMBRANE_TRANSPORTER_ACTIVITY",0.283367556468172,0.920175020970777,0.114266502484433,0.383254000515837,1.16174134129402,18,"Slc6a20a; Slc19a1; Slc22a4; Slc25a12; Slc25a32"
"GOMF_ORGANIC_ACID_TRANSMEMBRANE_TRANSPORTER_ACTIVITY",0.282786885245902,0.920175020970777,0.114266502484433,0.242680065935914,1.10207817693293,91,"Abcd1; Slc6a20a; Slc19a1; Slc27a4; Slc16a8; Slc38a10; Slc38a2; Slc1a5; Slc1a3; Slc25a12; Slc15a4; Slc25a21; Slc25a32; Slc32a1; Sfxn3; Slc6a11; Slc47a2; Slc36a3; Slc22a13; Grin3b; Slc25a22; Slc25a10; Grin2d"
"GOMF_OXIDOREDUCTASE_ACTIVITY_ACTING_ON_NAD_P_H",0.267822736030829,0.920175020970777,0.11378726182188,-0.315231526058755,-1.14392703068621,34,"Aifm3; Ndufa2; Por; Ndufs7; Aifm1; Txnrd1; Ndufa9; Ndufs3; Cbr1; Ndufs2; Cbr4; Cyb5r1; Ndufb7; Ndufs1; Rnls"
"GOMF_PHOSPHATASE_BINDING",0.28714859437751,0.920175020970777,0.111918316325105,0.221854701514232,1.09131693244113,153,"Atp2b4; Vrk3; Tmem225; Ppp1r3d; Ambra1; Kcnq1; Lck; Stat6; Kat2a; Pik3r1; Dlg2; Map3k5; Bad; Cdc5l; Phactr4; Strn; Grb2; Gna12; Lgals3; Bcl2; Gtf2f1; Ppp1r9a; Mapk14; Ppara; Ank1; Snx3; Sirpa; Sytl2; Cdh5; Cd22; Igbp1b; Slc9a1; Hsf4; Ncam1; Ppp6r2; Ptpa; Ppp3r1; Rps6kb1; Smg5; Ell; Lmna; Sh3yl1; Sptbn4; Anapc7; Phactr1; Kifap3; Dzip3; Ptprt"
"GOMF_PHOSPHOLIPID_BINDING",0.287968441814596,0.920175020970777,0.110564716336619,0.197199802455387,1.05678744142077,288,"Numa1; Plekhb2; Anxa3; Hspa8; Anxa11; Tulp1; Snca; Mycbpap; Pnpla3; Nrgn; Asap1; Arhgap44; Phf12; Plekha8; Kcnq1; Sytl5; Fermt2; Vamp2; Dysf; Laptm4b; Pctp; Snx18; Pacsin1; Pla2g10; Pitpnm2; Tnfaip8l3; Fcho2; Bad; Dnm1; Fchsd2; Bin2; Anxa1; Myof; Syt6; Rab35; Scarb1; Map1b; Unc13c; Plekhn1; Syt14; Epb41; Dab2; Cibar1; C2cd2l; Unc13a; Tpcn2; Tulp3; Snx3; Sytl2; Trpv1; Snx17; Pcyt1a; Plcz1; Hmgb1; Slc9a1; Deptor"
"GOMF_PROTEIN_PHOSPHORYLATED_AMINO_ACID_BINDING",0.283367556468172,0.920175020970777,0.114266502484433,0.299568696505258,1.10894143319024,35,"Abl1; Hck; Lck; Shb; Pik3r1; Grb2"
"GOMF_PROTEIN_TYROSINE_KINASE_ACTIVATOR_ACTIVITY",0.267961165048544,0.920175020970777,0.114266502484433,-0.378282486990792,-1.15193107762256,18,"Igf2; Ins1; Il6st; Ccl5; Igf1; Hbegf; Angpt4; Ghrl; Egf; Cd24a; Tgfa"
"GOMF_PROTEIN_TYROSINE_KINASE_ACTIVITY",0.276150627615063,0.920175020970777,0.117249716749792,0.254664720492394,1.10286263662041,70,"Abl1; Ltk; Hck; Ntrk1; Flt1; Lck; Fyn; Igf1r; Epha1; Mertk; Txk; Flt3; Peak1; Tesk2; Mst1r; Epha2"
"GOMF_RNA_ENDONUCLEASE_ACTIVITY_PRODUCING_5_PHOSPHOMONOESTERS",0.275862068965517,0.920175020970777,0.11146266692298,-0.369314544908576,-1.14736887772126,19,"Pop4; Prorp; Nudt16; Pld6; Rpp14; Fen1; Rnaseh1; Dbr1; Rpp21; Ago2; Rnaseh2a"
"GOMF_SODIUM_CHANNEL_REGULATOR_ACTIVITY",0.27831094049904,0.920175020970777,0.11101149245045,-0.356979414296067,-1.1375449938396,21,"Pcsk9; Nedd4; Agt; Fgf12; Fxyd1; Tmprss3; Fxyd4"
"GOMF_STEROL_TRANSFER_ACTIVITY",0.276717557251908,0.920175020970777,0.11101149245045,-0.389011159067693,-1.1594166547435,17,"Star; Apoe; Abca1"
