"pathway","pval","padj","log2err","ES","NES","size","leadingEdge"
"GOMF_TRANSCRIPTION_COREPRESSOR_ACTIVITY",0.286266924564797,0.920175020970777,0.109684061970549,-0.226011460389213,-1.08289453767621,128,"Asah1; Prmt5; Atf7ip; Sap18; Hipk2; Zmynd11; Gon4l; Sin3b; Zfp354b; Tle5; C1qbp; Gmnn; Hdgf; Mier2; Tcf25; Dnmt3b; Sfmbt1; Uri1; Chd4; Dmap1; Hdac1; Insm2; Ddx54; Kmt5a; Tsg101; Riox2; Dnajb1; Sap30; Lcor; Hdac3; Trib3"
"GOMF_TUMOR_NECROSIS_FACTOR_RECEPTOR_SUPERFAMILY_BINDING",0.287109375,0.920175020970777,0.110122263835536,-0.345454903548687,-1.13796455749569,24,"Siva1; Stat1; Tnfsf11; Bex3; Cflar"
"GOMF_MOLECULAR_FUNCTION_INHIBITOR_ACTIVITY",0.292,0.925940438871473,0.110564716336619,-0.199356284773968,-1.05188530438963,284,"Atp5if1; Serpini1; Apoc1; Rps20; Ywhab; Chmp3; Taf1; Smo; Wnk1; Wfikkn2; Cst8; Cdkn2c; Pcsk9; Tfpi2; Nedd4; Arpp19; Lef1; Rnh1; Fst; Itih2; Timp3; Cd55; Cast; Ppp1r14b; Cstdc1; Txnip; Tfpi; Bex3; Inca1; Calu; C1qbp; Wfdc5; Clec12b; Lxn; Lrpap1; Spry4; Taf3; Uri1; 2810408A11Rik; Wfdc17; Lrrk2; Birc5; Ppp1r2; Ppp1r36; Spink4; Rps7; Dus2; Ppp1r11; Socs3; Rgs2; Rack1; Cst9; Socs5; Wfdc3; Prkar1a; Cav1; Pabir1; Id2; Dnajb1; Ccl5; Rarres1; Wfdc1"
"GOMF_PRE_MRNA_BINDING",0.293103448275862,0.925940438871473,0.107554375265169,-0.33083236079509,-1.10591908472961,25,"Rbm20; Eri1; Rbm24; Snrpc; Sox9; Lsm1; Rnpc3; Srsf2; Zrsr2"
"GOMF_PROTEIN_SERINE_THREONINE_KINASE_ACTIVATOR_ACTIVITY",0.296015180265655,0.929855594506802,0.106323255932708,-0.295695783509878,-1.10822508659755,40,"Dele1; Cks2; Igf2; Ccny; Lgals9; Cdk5r2; Cab39l; Rad50; Igf1; Map3k13; Cks1b; Atg13; Topbp1"
"GOMF_4_IRON_4_SULFUR_CLUSTER_BINDING",0.542635658914729,0.931209150326797,0.0732558655828455,-0.263925099369094,-0.930326927987382,30,"Nubp1; Dpyd; Ndufs7; Lias; Ndufs2; Nubp2; Ddx11; Ciao3; Ppat; Ireb2; Tyw1; Ndufs1; Aco1; Isca2; Rtel1; Rsad1"
"GOMF_ACETYLGLUCOSAMINYLTRANSFERASE_ACTIVITY",0.475308641975309,0.931209150326797,0.0833634065110386,0.28152802177827,0.991562635720229,29,"Mgat4b; Mgat3; Extl1; Rfng; Pomgnt1; B3gnt3"
"GOMF_ACID_THIOL_LIGASE_ACTIVITY",0.53639846743295,0.931209150326797,0.0732558655828455,-0.304026781239813,-0.944535956131066,19,"Acsbg1; Acsl4; Slc27a6; Suclg2; Aacs; Slc27a3"
"GOMF_ACTININ_BINDING",0.47438330170778,0.931209150326797,0.0791316651768349,-0.298155772725056,-0.973759724970346,22,"Itgb1; Pdlim3; Pdlim4; Ldb3; Mypn; Rara; Pdlim5; Dag1; Nfkb1; Lmo7; Ttn; Pparg"
"GOMF_ACTIVE_TRANSMEMBRANE_TRANSPORTER_ACTIVITY",0.415686274509804,0.931209150326797,0.0880945010398517,0.195365590411482,1.01502993023134,227,"Slc29a3; Atp2b4; Abcd1; Slc6a20a; Slco2a1; Ndufs8; Cyb561d1; Slc19a1; Cftr; Atp1b2; Slc9a5; Slco6c1; Slc16a8; Slc22a4; Slc38a2; Slc1a5; Slc6a18; Slc34a3; Slc1a3; Slc24a1; Slc25a12; Abcb6; Slc15a4; Slc44a5; Slc5a2; Slc25a21; Abca3; Slc32a1; Slc17a4; Slc9b1; Slc9c1; Slc5a5; Abcc8; Tap1; Slc6a11; Ndufv2; Slc37a4; Slc22a8; Slc47a2"
"GOMF_ADP_BINDING",0.364864864864865,0.931209150326797,0.0946646223153342,-0.313640570045684,-1.07037357173171,27,"Prps2; Apaf1; Glud1; Myh9; Gck; Chordc1"
"GOMF_ALDEHYDE_DEHYDROGENASE_NAD_P_PLUS_ACTIVITY",0.435146443514644,0.931209150326797,0.0891647117820678,0.342973933126599,1.02033391592132,17,"Aldh3b2; Aldh2; Aldh1a1; Aldh9a1"
"GOMF_ALPHA_ACTININ_BINDING",0.43503937007874,0.931209150326797,0.0857844408075645,-0.351608965300249,-1.02208516181852,16,"Itgb1; Pdlim3; Pdlim4; Ldb3; Mypn; Rara; Pdlim5; Dag1"
"GOMF_ALPHA_TUBULIN_BINDING",0.362139917695473,0.931209150326797,0.0988903007520636,0.299961430477716,1.06823046030277,30,"Taok1; Snca; Sncb; Fyn; Dysf; Tbce; Efhc1; Lrrc61; Spast"
"GOMF_AMIDE_TRANSMEMBRANE_TRANSPORTER_ACTIVITY",0.425263157894737,0.931209150326797,0.0908241419007155,0.321599564842087,1.02998945253018,22,"Abcd1; Slc19a1; Slc15a4; Slc25a32; Slc25a47"
"GOMF_AMINOACYLTRANSFERASE_ACTIVITY",0.573705179282869,0.931209150326797,0.0718276293603809,-0.181494295958628,-0.953998250117196,271,"Itch; Ube2l3; Rnf148; Nfx1; Rnf146; Trim14; Med17; Atg10; Rnf8; Ube2d4; Taf1; Cbll1; Fbxo11; Rnf170; Xiap; Nedd4; Tnfaip1; Cop1; Trim7; Fbxo44; Atg12; Med31; Kcmf1; Sh3rf3; Fbxo15; Skp1; Fbxl3; Siah1b; Smurf2; Dtx2; Rnf128; Stub1; Birc5; Lrsam1; Ube2i; Wsb1; Maea; Ube2a; Ube2d3; Rnf169; Birc3; Ppp1r11; Mul1; Sh3rf1; Ube2q2l; Trim8; Trim58; Marchf4; F13a1; Rnf223; Trim62; Peli3; Peli2; Siah2; Ube2q1; Rnf227; Fbxo6; Ube2s; Fbxw11; Cdc42; Jade2; Hectd3; Rad18"
"GOMF_ATPASE_ACTIVATOR_ACTIVITY",0.392197125256673,0.931209150326797,0.0940503465727813,0.345839368623741,1.04832797945085,18,"Ahsa1; Atp1b2; Dnajb6; Atp6ap1l; Dnaja1; Tor1aip1"
"GOMF_ATPASE_COUPLED_INTRAMEMBRANE_LIPID_TRANSPORTER_ACTIVITY",0.328740157480315,0.931209150326797,0.102080107662747,-0.380575218853088,-1.1062865925885,16,"Abca1; Atp9a; Atp8a1; Atp10b; Atp11c; Atp10d"
"GOMF_ATPASE_REGULATOR_ACTIVITY",0.477669902912621,0.931209150326797,0.0799858801499946,-0.276709634835126,-0.988115418653151,32,"Atp5if1; Grpel1; Rab6a; Atp6ap1"
"GOMF_ATP_DEPENDENT_CHROMATIN_REMODELER_ACTIVITY",0.368121442125237,0.931209150326797,0.0931454575337804,-0.326839236176172,-1.06743827838582,22,"Ino80; Smarca1; Smarca5; Smarca2; Chd4"
"GOMF_ATP_HYDROLYSIS_ACTIVITY",0.323293172690763,0.931209150326797,0.104343952581949,0.208223437570088,1.06095988511073,194,"Kif19a; Gpn1; Atp2b4; Abcd1; Hspa8; Iqca1; Ola1; Cftr; Smc4; Dmc1; Kif18b; Cct6b; Rad51d; Rad51b; Rfc3; Cct4; Psmc6; Dnah3; Ddx3x; Cdc6; Abcb6; Abca3; Abcf3; Mcm3; Myo19; Morc3; Pms2; Kif1b; Tap1; Chd8; Kif17; Rad17; Rfc5; Atp5pf; Atp1a2; Smc1b; Kifc2; Msh2; Atp8b5; Kif2a; Spast"
"GOMF_BASAL_TRANSCRIPTION_MACHINERY_BINDING",0.571698113207547,0.931209150326797,0.0692836467392548,-0.238227476808384,-0.92507157153445,45,"Ncoa3; Fbl; Taf1; Polr2m; Uri1; Llph; Ruvbl1; Supt4a; Nolc1; Esr1; Tcf4; Smyd2; Ago2; Taf7; Myzap; Edf1; Gtf2e2; Ago1; Zfp326"
"GOMF_BETA_TUBULIN_BINDING",0.573804573804574,0.931209150326797,0.0739901439101341,0.272118885310192,0.924119156758464,26,"Taok1; Snca; Ranbp10; Sncb; Tbcd; Spast; Emd; Tbca; Smc3; Gabarap; Sncg; Dlec1; Clxn"
"GOMF_CADHERIN_BINDING",0.536016949152542,0.931209150326797,0.0785029047348687,0.243809143534577,0.939891962301597,43,"Ank3; Ctnnd2; Cdh15; Cdh3; Cdh23; Cdh5; Cd2ap; Cdh18; Ctnna2; Prom1; Cdh26; Pkp3; Ptprt; Ptpn11"
"GOMF_CALCIUM_DEPENDENT_PHOSPHOLIPID_BINDING",0.329218106995885,0.931209150326797,0.104732821580651,0.306229721462767,1.07856385958142,29,"Anxa3; Anxa11; Dysf; Anxa1; Syt6; Syt14; Cpne5; Syt8"
"GOMF_CALMODULIN_BINDING",0.338742393509128,0.931209150326797,0.102080107662747,0.223647241045023,1.05353314755425,114,"Atp2b4; Myo1f; Cacna1a; Enkur; Nrgn; Sry; Kcnq1; Camsap1; Vamp2; Pik3r1; Camk1d; Pde1a; Strn; Unc13c; Cnn3; Ryr3; Epb41; Ppp3ca; Scn5a; Trpm4; Unc13a; Trpv1; Pcyt1a; Slc9a1; Mapkapk5; Myo1d"
"GOMF_CALMODULIN_DEPENDENT_PROTEIN_KINASE_ACTIVITY",0.558823529411765,0.931209150326797,0.0723570851036907,-0.326326944679569,-0.928303273747503,15,"Camk2b; Camk2g; Camk4"
"GOMF_CARBOHYDRATE_BINDING",0.365384615384615,0.931209150326797,0.0943563635421779,-0.21492815449357,-1.03498045826341,132,"Prps2; Bsg; Gyg1; Ppp1r3e; Fam3c; Ugp2; Gnpnat1; Nptx2; Clec2l; G6pd2; Galnt10; Egln1; Pfkl; Lgals9; Adgrl2; Gck; Clec12b"
"GOMF_CARBOXYPEPTIDASE_ACTIVITY",0.426356589147287,0.931209150326797,0.0860347242455604,-0.313355217682163,-1.02333013653071,23,"Folh1; Cpvl; Mindy2; Aebp1"
"GOMF_CATALYTIC_ACTIVITY_ACTING_ON_A_RRNA",0.3,0.931209150326797,0.107554375265169,-0.401683422857007,-1.14267008142527,15,"Tsr3; Fbl; Mettl5; Mettl16; Nsun5"
"GOMF_CCR_CHEMOKINE_RECEPTOR_BINDING",0.398467432950192,0.931209150326797,0.0891647117820678,-0.333514748011065,-1.03614776998202,19,"Stat1; Nup85; Msmp; Defb33; Ccl5"
"GOMF_CELL_ADHESION_MOLECULE_BINDING",0.375757575757576,0.931209150326797,0.0956031492204301,-0.206697186096754,-1.02917866221454,177,"Tspan8; Tenm3; Itgb1; Rpsa; Cd81; Lamb2; Ccn4; Jam3; Mfge8; Cdh4; Nexn; Ccn2; Itgbl1; Tspan4; Ccn1; Adam9; Src; S1pr3; Igf2; Pvr; Sema7a; Neo1; Myh9"
"GOMF_CHEMOKINE_RECEPTOR_BINDING",0.344961240310078,0.931209150326797,0.0982123351217438,-0.308678642551112,-1.0760606901064,29,"Itch; Stat1; Nup85; Cxcl16; Msmp"
"GOMF_CHEMOREPELLENT_ACTIVITY",0.529774127310062,0.931209150326797,0.0774767547848578,0.30995792068123,0.939562092064939,18,"Sema6d; Sema4d; Sema4b; Sema4c; Apoa1; Nrg1; Sema3f; Sema4g; Sema3b; Slit2"
"GOMF_CHOLESTEROL_BINDING",0.418604651162791,0.931209150326797,0.0870515867946735,-0.288083214121908,-1.02393029045545,31,"Star; Cyp11a1; Cd81; Osbpl7; Stard4; Osbpl8; Osbpl10"
"GOMF_CLATHRIN_BINDING",0.481060606060606,0.931209150326797,0.0782955249944794,-0.263790550735554,-0.97936823129018,38,"Clba1; Pik3c2a; Syt3; Clta; Syt5; Lrrk2; Enthd1; Ap1b1; Sclt1; Gpr107; Syt4; Aftph"
"GOMF_CORECEPTOR_ACTIVITY",0.559251559251559,0.931209150326797,0.0753093764172773,0.278191425178497,0.94474157852123,26,"Rgmb; Il17rc; Cspg4; Cd8b1"
"GOMF_CYSTEINE_TYPE_ENDOPEPTIDASE_ACTIVITY",0.379047619047619,0.931209150326797,0.0916795246008379,-0.288358301095007,-1.05429037161945,36,"Ctsh; Usp16; Ctsf; Capn2; Capn8; Pigk; Cflar; Adgb; Lgmn"
"GOMF_CYTOSKELETAL_MOTOR_ACTIVITY",0.39873417721519,0.931209150326797,0.0946646223153342,0.233722113503583,1.02028837265753,75,"Kif19a; Myo1f; Cenpe; Actc1; Kif11; Kif18b; Dnah3; Myl3; Myo19; Kif1b; Kif17; Kifc2; Kif2a; Myo1d; Kif6; Dnai2; Dnah7b; Kif21b; Dnah12; Myo7b; Myo1a; Myo18a; Kif21a; Kifc3"
"GOMF_DEACETYLASE_ACTIVITY",0.555093555093555,0.931209150326797,0.0756946307932749,0.278557636262953,0.945985235969619,26,"Hdac7; Oard1; Mta2; Amdhd2; Sirt7; Hdac11; Hdac5; Macrod1"
"GOMF_DEAMINASE_ACTIVITY",0.577235772357724,0.931209150326797,0.0725351864394589,0.310722822104091,0.892211611306026,15,"Adat2; Ampd1; Apobec3; Adad2; Ada; Lacc1; Rida; Adat1"
"GOMF_DEMETHYLASE_ACTIVITY",0.4510556621881,0.931209150326797,0.0824344091527096,-0.31736685450989,-1.01131623309496,21,"Alkbh2; Riox2; Kdm6a; Phf2; Kdm5c; Kdm4c; Jmjd6; Kdm3b; Kdm2b"
"GOMF_DISORDERED_DOMAIN_SPECIFIC_BINDING",0.53742802303263,0.931209150326797,0.0732558655828455,-0.296226991878278,-0.943952278917194,21,"Ncoa3; Smad2; Bcl2l2; Hsp90ab1; Tead2; Tpm1"
"GOMF_DNA_EXONUCLEASE_ACTIVITY",0.385826771653543,0.931209150326797,0.0925528864684773,-0.364062424667468,-1.05828587706956,16,"Dclre1c; Rad9a; Pld3; Dclre1a"
"GOMF_DNA_HELICASE_ACTIVITY",0.450292397660819,0.931209150326797,0.0833634065110386,-0.289052469625013,-0.993354327904303,28,"Nav2; Ercc3; Xrcc6; Hfm1; Ddx11; Rfc2; Mcm5; Rad50; Twnk; Dscc1; Ruvbl1"
"GOMF_DOPAMINE_RECEPTOR_BINDING",0.526315789473684,0.931209150326797,0.0770736734944102,0.318972051911801,0.940766515586775,16,"Agtr1a; Grk3; Dnm1; Gna12"
"GOMF_DOUBLE_STRANDED_RNA_BINDING",0.435849056603774,0.931209150326797,0.0833634065110386,-0.262022738960122,-1.01747199842345,45,"Dhx33; Zfr2; Ddx21; Lsm14a; Hsp90ab1; Zfr; Stau2; Dus2; Elavl1; Prkra; Rigi; Mbnl1; Eif2ak2; Oasl2; Zbp1"
"GOMF_DYNEIN_COMPLEX_BINDING",0.369609856262834,0.931209150326797,0.09754492162472,0.351292714431243,1.0648584716686,18,"Numa1; Snca"
"GOMF_DYNEIN_INTERMEDIATE_CHAIN_BINDING",0.543186180422265,0.931209150326797,0.0727141077934447,-0.274640384950345,-0.929535003255694,26,"Ran; Frrs1l; Htt; Dynll2; Trim58; Hook3; Dynlrb1; Dnah17; Dnah5; Dynlt2b; BC048507"
"GOMF_ENDONUCLEASE_ACTIVITY_ACTIVE_WITH_EITHER_RIBO_OR_DEOXYRIBONUCLEIC_ACIDS_AND_PRODUCING_5_PHOSPHOMONOESTERS",0.49609375,0.931209150326797,0.0782955249944794,-0.292457744073207,-0.963386375187318,24,"Pop4; Prorp; Nudt16; Pld6; Rpp14; Fen1; Rnaseh1; Exo1; Dbr1; Rpp21; Ago2; Rnaseh2a"
"GOMF_ENDOPEPTIDASE_ACTIVITY",0.348884381338742,0.931209150326797,0.10027910675413,-0.206945729734391,-1.04249094191498,205,"Ctsh; Mmel1; Adam10; Ctsd; Psmb6; Tpsab1; Adamtsl2; Usp16; Ctsf; Mme; Capn2; Pcsk9; Adam9; Prss32; Prss52; Adamts5; Adamts20; Lonp2; Adamts3; Ndel1; Try4; Tmprss3; Adamts2; Prss50; Klk1b21; Cym; Klk4; Mbtps1; Prss1l; Psen2; Capn8; Prss2; Ren1; Pigk; Prss35; Cflar; Klk1b22; Rhbdl2; Adgb; Lgmn; Plat; Psmd13; Lmln; Htra1; Adam29"
"GOMF_ENZYME_INHIBITOR_ACTIVITY",0.30784708249497,0.931209150326797,0.107554375265169,-0.207594244797426,-1.05138452991356,212,"Serpini1; Apoc1; Rps20; Ywhab; Smo; Wnk1; Wfikkn2; Cst8; Cdkn2c; Tfpi2; Arpp19; Rnh1; Itih2; Timp3; Cd55; Cast; Ppp1r14b; Cstdc1; Txnip; Tfpi; Inca1; Calu; C1qbp; Wfdc5; Lxn; Spry4; Uri1; 2810408A11Rik; Wfdc17; Lrrk2; Birc5; Ppp1r2; Ppp1r36; Spink4; Rps7; Dus2; Ppp1r11; Socs3; Rgs2; Rack1; Cst9; Socs5; Wfdc3; Prkar1a; Cav1; Pabir1; Rarres1; Wfdc1; Itprip; Tmx1; Trib3; Serpinb6b; Rock1; Eppin; Crim1; Ppp1r14bl; Sbf1; Uchl5; Nolc1; Ppp1r12b"
"GOMF_ENZYME_SUBSTRATE_ADAPTOR_ACTIVITY",0.567510548523207,0.931209150326797,0.0753093764172773,0.249013240960882,0.928871263980631,38,"Ambra1; Pnkp; Nmnat2; Pef1; Pramel5; Spsb4; Rbm47; Spsb1; Pdcd6"
"GOMF_EXTRACELLULAR_MATRIX_STRUCTURAL_CONSTITUENT",0.498134328358209,0.931209150326797,0.0756946307932749,-0.221662980634893,-0.966350702452252,82,"Spock2; Nid2; Lama4; Nid1; Lamb2; Spon1; Mfge8; Mfap2; Lamc1; Efemp1; Dcn; Hmcn1; Emid1; Col9a3; Col14a1; Lama2"
"GOMF_FAD_BINDING",0.535787321063395,0.931209150326797,0.0766746872490091,0.272023384126669,0.953462240201388,28,"Aox3; Prodh; Cyb5r3; Mical3; Mical1"
"GOMF_FIBROBLAST_GROWTH_FACTOR_RECEPTOR_BINDING",0.584466019417476,0.931209150326797,0.0696133438850965,-0.30535000389201,-0.92983992421499,18,"Fgf22; Fgf12; Fgf9; Fgf17; Klb; Fgf8; Fgf1"
"GOMF_FIBRONECTIN_BINDING",0.562015503875969,0.931209150326797,0.0714786287425507,-0.291939704097496,-0.918529175751012,20,"Itgb1; Ccn2; Mfap2"
"GOMF_GALACTOSYLTRANSFERASE_ACTIVITY",0.461382113821138,0.931209150326797,0.0843144320642653,0.344473201095497,0.989122677632604,15,"A3galt2; B4galt7; Plod3; B4galt6; Cercam; B3gntl1"
"GOMF_GROWTH_FACTOR_RECEPTOR_BINDING",0.597014925373134,0.931209150326797,0.0665892104103933,-0.212377217713926,-0.925868960774955,82,"Pdgfd; Ticam2; Snx1; Erbb4; Fgf22; Fgf12; Efemp1; Pspn; Fgf9; Il6st; Fgf17; Socs5; Klb; Sdcbp; Nherf1; Timm50; Hbegf; Angpt4; Fer; Ern1; Fgf8; Egf"
"GOMF_GTPASE_BINDING",0.5078125,0.931209150326797,0.0770736734944102,0.191815208869141,0.987643626599195,206,"Lztr1; Rasip1; Usp6nl; Dock5; Dnm1l; Arhgap44; Ambra1; Arhgdib; Rasgrf1; Sytl5; Plekhg2; Ranbp10; Exoc5; Atg14; Akap13; Exph5; Rab7; Rims3; Rph3al; Rap1a; Fmnl1; Cyria; Xpo7; Brk1; Mical1; Tnpo1; Aimp1; Myrip; Ppp1r9a; Pih1d2; Pot1b; Rab11fip3; Bnip3; Sytl2; Sike1; Coro1c; Bicd1; Asb14; Sorl1; Gm14137; Rbsn; Ybx1; Rgl3; Cyrib"
"GOMF_GUANYL_NUCLEOTIDE_EXCHANGE_FACTOR_ACTIVITY",0.380855397148676,0.931209150326797,0.0952879846194844,0.216349192475349,1.02493805112458,123,"Arfgef3; Sh3bp5l; Dock5; Eif2b2; Dock6; Rasgrf1; Plekhg2; Ranbp10; Kndc1; Rgl1; Arhgef19; Akap13; Elmo1; Rap1a; Eif2b5; Psd3; Rapgef5"
"GOMF_G_PROTEIN_ALPHA_SUBUNIT_BINDING",0.53742802303263,0.931209150326797,0.0732558655828455,-0.296246782507379,-0.944015343424997,21,"F2r; Myh9; Lpar3; Gpsm2; Rgs2; Drd1; Ric8b; Nucb2"
"GOMF_HEPARIN_BINDING",0.380952380952381,0.931209150326797,0.096240602328129,0.224256982963056,1.0306012703781,100,"Col11a2; Aoc1; Igfals; Nell2; Col25a1; Zfp207; Smoc2; Hsd17b12; Serpine2; Serpinc1; Aamp; Col13a1; Twsg1; Vegfa; Bmp7; Hmgb1; Ncam1; Ccdc80; Cxcl11; Vtn; Pf4; Rtn4rl1"
"GOMF_HORMONE_ACTIVITY",0.443378119001919,0.931209150326797,0.0833634065110386,-0.253892585848889,-1.00147097407271,50,"Qrfp; Ghrh; Npff; Igf2; Agt; Ins1; Pyy; Copa; Npy; a; Cartpt; Igf1; Ghrl; Gnrh1; Fndc5"
"GOMF_HORMONE_BINDING",0.596194503171247,0.931209150326797,0.0728938564822936,0.225011922082118,0.912969792242932,52,"Gipr; Cmklr1; Igf1r; Pik3r1; Ucn2; Calcrl; Crym; C2cd2l; Atp1a2; Mchr1; Crhbp; Aldh1a3"
"GOMF_HYDRO_LYASE_ACTIVITY",0.567829457364341,0.931209150326797,0.0709609456938284,-0.258043561940235,-0.917160759029212,31,"Echs1; Alad; Hacd3; Car5b; Tbxas1; Hmbs; Ireb2; Pcbd2; Apip; Echdc3; Eno1; Aco1; Cyp1b1; Naxd"
"GOMF_INTRAMOLECULAR_TRANSFERASE_ACTIVITY",0.395348837209302,0.931209150326797,0.0902635484340068,-0.329539154193,-1.03682823346802,20,"Pgm3; Pgam1; Dkc1; Rpusd4"
"GOMF_ISOPRENOID_BINDING",0.36046511627907,0.931209150326797,0.0956031492204301,-0.337788358696865,-1.06278268538801,20,"Rbp7; Rho; Akr1b8; Opn3; Rbp1; Lcn12; Rara; Adh7; Serpina5; Rabggtb"
"GOMF_KINASE_ACTIVATOR_ACTIVITY",0.424528301886792,0.931209150326797,0.0847985102819124,-0.227082758961937,-0.997760898232483,85,"Dele1; Cks2; Wnk1; Igf2; Ccny; Lgals9; Bcl10; Cdk5r2; Gprc5c; Ccnq; Ins1; Il6st; Cab39l; Prkra; Ccl5; Rad50; Igf1; Hbegf; Angpt4; Ghrl; Egf; Map3k13; Cks1b; Atg13; Topbp1; Cd24a; Ccnd2; Tgfa; Mlst8; Daxx; Vac14; Rictor; Rplp1rt"
"GOMF_KINASE_ACTIVITY",0.565815324165029,0.931209150326797,0.0718276293603809,0.173839481991019,0.967789094354579,412,"Dmpk; Trpm7; Abl1; Vrk3; Irak4; Nrbp1; Ltk; Taok1; Adpgk; Sik2; Ak2; Dguok; Hck; Dgkk; Pnkp; Slk; Ntrk1; Flt1; Lck; Hk2; Fyn; Grk3; Nme3; Pck1; Igf1r; Sgms2; Ern2; Pik3r1; Mst1; Ak1; Stk40; Camk1d; Pdk4; Dgkd; Stk-ps2; Pank1; Map3k5; Pik3r6; Speg; Aldh18a1; Grk4; Cdk8; Pi4k2a; Prkag3; Epha1; Pbk; Mertk; Prkdc; Prkd3; 4921509C19Rik; Rps6ka1; Txk; Mmd2; Flt3; Peak1; Map4k2; Mapk14; Smok2a; Taok3; Cdk5; Tesk2; Dcakd; Papss1; Mst1r; Pip5kl1; Cdkl1; Map3k1; Cdk14; Epha2; Stk17b; Pfkfb1; Riok2; Map3k12; Mapkapk5; Stkld1; Cdk11b; Itpk1; Pik3cb; Dyrk1b; Mok; Tssk5; Gk2; Mapk7; Camk2d; Cdc7; Grk1; Chek1; Top1; Gm7168; Rps6kb1; Lmtk3; Eef2k; Dolk; Araf"
"GOMF_KINASE_INHIBITOR_ACTIVITY",0.441904761904762,0.931209150326797,0.083129129135339,-0.255720761604439,-1.01114523121263,51,"Ywhab; Smo; Wnk1; Cdkn2c; Inca1; Spry4; Dus2; Socs3; Rack1; Socs5; Prkar1a; Cav1; Itprip; Trib3; Nolc1; Cdkn2d; Prkar2b; Cdkn1b; Nck1; Akt1s1; Dnajc3; Cib1; Spred1"
"GOMF_KINESIN_BINDING",0.462025316455696,0.931209150326797,0.0862865626267245,0.266119215241969,0.992680111617732,38,"Kcna2; Snca; Kif18b; Mapk8ip1; Fam83d; Clstn2; Ktn1"
"GOMF_LIGAND_GATED_MONOATOMIC_ANION_CHANNEL_ACTIVITY",0.506796116504854,0.931209150326797,0.0768736734126542,-0.319816118413666,-0.973891572025868,18,"Gabra1; Slc1a7; Best1; Ano7; Ano5; Slc17a7; Ttyh2; Ano10"
"GOMF_LIPID_KINASE_ACTIVITY",0.417879417879418,0.931209150326797,0.0911073131586733,0.325011088445557,1.0366625101161,21,"Dgkk; Pik3r1; Dgkd; Pik3r6; Pi4k2a; Pip5kl1; Pik3cb"
"GOMF_LIPOPOLYSACCHARIDE_BINDING",0.597916666666667,0.931209150326797,0.072003313661988,0.287813477163977,0.889177293346722,19,"Zranb2; Defb19; Scarb1; Hmgb1; H2bc21; Nlrp6; Psmb4; Camp"
"GOMF_L_AMINO_ACID_TRANSMEMBRANE_TRANSPORTER_ACTIVITY",0.379746835443038,0.931209150326797,0.09754492162472,0.275819972484,1.04064296522882,39,"Slc6a20a; Slc38a10; Slc38a2; Slc1a5; Slc1a3; Slc25a12; Slc15a4; Slc32a1; Sfxn3; Slc47a2; Slc36a3"
"GOMF_MACROMOLECULE_TRANSMEMBRANE_TRANSPORTER_ACTIVITY",0.415637860082305,0.931209150326797,0.0908241419007155,0.327912066083206,1.03169837817635,20,"Timm17a; Sec61a1; Sec63; Slc15a4"
"GOMF_METALLOENDOPEPTIDASE_ACTIVITY",0.36965811965812,0.931209150326797,0.0999276973731092,0.244944057348702,1.0362490354744,63,"Adam11; Mmp17; Phex; Adam33; Adam25; Adam1b; Adamts14; Adam21; Adamts7; Adam6a; Adamts19; Mmp12; Mmp10; Mmp28; Thop1; Nln"
"GOMF_METALLOEXOPEPTIDASE_ACTIVITY",0.392233009708738,0.931209150326797,0.0908241419007155,-0.284461934731887,-1.03041716956025,35,"Folh1; Adam10; Nudt16; Lta4h; Aebp1"
"GOMF_METAL_CATION_MONOATOMIC_CATION_ANTIPORTER_ACTIVITY",0.55977229601518,0.931209150326797,0.070619624712259,-0.282129597595753,-0.921419152310606,22,"Slc9a6; Slc9a2; Slc41a1; Slc17a7; Tmco3; Slc8b1"
"GOMF_METAL_CLUSTER_BINDING",0.337142857142857,0.931209150326797,0.0985499803531691,-0.273387890131998,-1.08100280807803,51,"Aifm3; Glrx3; Nubp1; Kif4; Dph2; Dpyd; Ndufs7; Lias; Cisd2; Ndufs2; Uqcrfs1; Nubp2; Ddx11; Aox4; Iscu; Fdx1; Ciao3; Ppat; Ireb2; Tyw1; Ndufs1; Aco1; Isca2; Rtel1"
"GOMF_MICROFILAMENT_MOTOR_ACTIVITY",0.326375711574953,0.931209150326797,0.10027910675413,-0.338929612677135,-1.10692475751303,22,"Myo6; Myh7; Myh11; Myo9a; Myh9"
"GOMF_MICROTUBULE_BINDING",0.371769383697813,0.931209150326797,0.0952879846194844,0.205036784224204,1.03678940827689,184,"Kif19a; Numa1; Cep135; Cenpe; Saxo2; Snca; Terf1; Mtus1; Gas2; Dnm1l; Kif11; Kif18b; Zfp207; Camsap1; Dysf; Dnm1; Map7d3; Ccdc88b; Map1b; Cnn3; Kif1b; Kif17; Fam83d; Svbp; Nin; Kifc2; Kif2a; Cep350; Spast; Dst; Ccdc66; Ccdc181; Kif6; Strbp; Fsd1; Map4; Gas2l3; Kif21b; Clip1; Reep4; Fes; Map1lc3b; Cep44; Kif21a; Kifc3; Whamm; Mdm1; Dlgap5; Katnal1; Nde1"
"GOMF_MIRNA_BINDING",0.432098765432099,0.931209150326797,0.0886261133285098,0.313158549215751,1.02262661097058,23,"Ago3; Trim71; Pnpt1; Dicer1; Ybx1; Spout1; Lin28a"
"GOMF_MODIFICATION_DEPENDENT_PROTEIN_BINDING",0.486166007905138,0.931209150326797,0.0799858801499946,-0.211911024030598,-0.979621035360864,111,"Cbx3; Rrp8; Zcwpw2; Aplf; Lrwd1; Ttll12; Zmynd11; Taf1; Laptm5; Mindy2; L3mbtl3; Cbx5; Rnf169; Agl; Brcc3; Htatsf1; Phf2; Optn; Parp2; Rad18; Mpnd; Tab3; Kdm4c; Pwp1; Zzz3; Mtf2; Topbp1; Atrx; Brd3; Babam2; Parp10; Fmr1; Taf7; Mllt3; Brcc3dc; Daxx; Zranb3; Rnf31; Cdyl2; Hspd1; Ccdc38; Gm20826"
"GOMF_MONOATOMIC_ANION_TRANSMEMBRANE_TRANSPORTER_ACTIVITY",0.523504273504274,0.931209150326797,0.0802023444698144,0.22487693775715,0.95135400455764,63,"P2rx5; Clcnkb; Slc19a1; Cftr; Slc6a18; Gabre; Slc5a5; Ano2; Slc6a11; Clic1; Ttyh3; Clcn7; Slc12a3; Slc12a7; Lrrc8a; Pacc1; Slc17a8; Slc6a6; Apol8; Slc4a3; Slc6a1; Oca2; Slc39a14"
"GOMF_MONOCARBOXYLIC_ACID_BINDING",0.493408662900188,0.931209150326797,0.0766746872490091,-0.254298513972081,-0.96653872712211,42,"Apoc1; Ffar4; Gstm7; Rbp7; Insr; Acox1; Acacb; Rbp1; Lcn12; Prr7; Arhgdia; Napepld; Adh5; Scp2; Rara; Serpina5; Acaca"
"GOMF_MONOCARBOXYLIC_ACID_TRANSMEMBRANE_TRANSPORTER_ACTIVITY",0.592592592592593,0.931209150326797,0.0718276293603809,0.254731881288014,0.907157811485039,30,"Abcd1; Slc27a4; Slc16a8; Slc32a1; Slc6a11; Slc22a13"
"GOMF_MONOOXYGENASE_ACTIVITY",0.390495867768595,0.931209150326797,0.0946646223153342,0.259394611891064,1.0191289366368,46,"Cyp2f2; Cyp11b2; Pam; Cyp2d9; Mical3; Cyp2d40; Akr1d1; Cyp2c29; Cyp2c23; Cyp2d26; Mical1; Akr1cl; Cyp19a1; Cyp26c1; Cyp4f18; Fmo5"
"GOMF_MONOSACCHARIDE_BINDING",0.469230769230769,0.931209150326797,0.080419996876154,-0.248207610576935,-0.991397007298766,54,"Bsg; Gyg1; Ugp2; Gnpnat1; G6pd2; Egln1; Pfkl; Gck; Alpk1; Cln5"
"GOMF_MYOSIN_BINDING",0.544513457556936,0.931209150326797,0.0764767053228531,0.224988006423441,0.940342614481631,57,"Trpm7; Taok1; Myl12b; Actc1; Vamp2; Myl9; Ampd1; Cald1; Myo19; Myrip; Coro1a; Rab10; Larp6"
"GOMF_NEUROTRANSMITTER_RECEPTOR_ACTIVITY",0.564547206165703,0.931209150326797,0.0709609456938284,-0.255379029169388,-0.926731466835631,34,"Gabra1; Htr4; Chrm1; Grid1; Htr5b; Grm5; Hrh2"
"GOMF_NF_KAPPAB_BINDING",0.404174573055028,0.931209150326797,0.0878312634480124,-0.317557576927522,-1.03712490938871,22,"Psma6; Bcl10; Notch2; Trp53bp2; Hdac1; Hdac3; Hdac2; Cdk5rap3"
"GOMF_NUCLEAR_ESTROGEN_RECEPTOR_BINDING",0.597302504816956,0.931209150326797,0.0681513438679483,-0.250547135847374,-0.909197264436684,34,"Ncoa3; Lef1; Src; Trip4; Hsd17b10; Ddx54; Psmc3ip; Lcor; Taf10; Esr1; Dcaf13; Ccdc62; Prmt2"
"GOMF_NUCLEAR_RECEPTOR_BINDING",0.40655105973025,0.931209150326797,0.0883594442500905,-0.225139100703994,-1.02456210664303,100,"Asah1; Stat1; Tcf7l2; Ncoa3; Med17; Taf1; Lef1; Src; Ets2; Foxp1; Trip4; Hsd17b10"
"GOMF_NUCLEAR_RETINOIC_ACID_RECEPTOR_BINDING",0.465020576131687,0.931209150326797,0.0845557442441281,0.300495220336683,0.981274212552468,23,"Ncoa6; Cnot1; Sumo2; Pramel13; Nrip1; Ncoa1; Tacc1"
"GOMF_NUCLEAR_THYROID_HORMONE_RECEPTOR_BINDING",0.398785425101215,0.931209150326797,0.0922597260527354,0.356588476505188,1.0517112597468,16,"Med12; Ncoa6"
"GOMF_NUCLEOSOME_BINDING",0.553030303030303,0.931209150326797,0.0711327399327894,-0.251211705748034,-0.932667084745128,38,"H2ac1; Sap30l; Smarca1; Hp1bp3; Smarca5; Rnf169; H2az1; H2ax; Parp2; H1f10; Eed; H2az2"
"GOMF_NUCLEOTIDYLTRANSFERASE_ACTIVITY",0.590822179732314,0.931209150326797,0.0683110858318647,-0.211176623790564,-0.937588009348793,89,"Polr3a; Nmnat3; Ugp2; Papolg; Poll; Tiparp; Prim1; Dkc1; Fhit"
"GOMF_N_METHYLTRANSFERASE_ACTIVITY",0.579654510556622,0.931209150326797,0.0694481442003175,-0.235175039215038,-0.927640225541872,50,"Prmt5; Prmt3; Prmt1; Fbl; Mettl5; Smyd5; Fbxo11; Mettl16"
"GOMF_ORGANIC_ACID_SODIUM_SYMPORTER_ACTIVITY",0.483739837398374,0.931209150326797,0.0817515582532145,0.336092653669466,0.96505871711637,15,"Slc6a20a; Slc38a2; Slc1a3; Slc6a11"
"GOMF_ORGANIC_ANION_TRANSMEMBRANE_TRANSPORTER_ACTIVITY",0.438923395445135,0.931209150326797,0.0880945010398517,0.209075063634668,0.997600272026294,131,"Abcd1; Slc6a20a; Slco2a1; Slc19a1; Cftr; Slc27a4; Slco6c1; Slc16a8; Slc38a10; Slc38a2; Slc1a5; Slc1a3; Slc25a12; Slc15a4; Slc25a21; Slc25a32; Slc32a1; Rtbdn; Sfxn3; Slc6a11; Slc37a4; Slc22a8; Slc25a47; Slc47a2; Slc36a3; Slc22a13; Slc39a8; Grin3b; Slc25a22; Slc25a10; Grin2d"
"GOMF_ORGANIC_HYDROXY_COMPOUND_TRANSMEMBRANE_TRANSPORTER_ACTIVITY",0.396116504854369,0.931209150326797,0.0902635484340068,-0.346491109291403,-1.05512121401062,18,"Slc2a13; Abcb11; Aqp7; Aqp2; Slc10a7; Slco1a4; Abcg1; Slc5a3; Slc22a1"
"GOMF_ORGANOPHOSPHATE_ESTER_TRANSMEMBRANE_TRANSPORTER_ACTIVITY",0.559251559251559,0.931209150326797,0.0753093764172773,0.27785469565031,0.943598040808702,26,"Abcd1; Slc19a1; Slc25a32; Slc25a36; Slc37a4; Slc25a47"
"GOMF_OXIDOREDUCTASE_ACTIVITY_ACTING_ON_CH_OH_GROUP_OF_DONORS",0.4375,0.931209150326797,0.0905428948469474,0.228739106475285,1.00125900637338,79,"Hadh; L2hgdh; Hsd11b2; Dhrs7b; Phgdh; Idh1; Ugdh; Hsd17b12; Akr1d1; Dhrs7c; Akr1cl; Spr; Ldhal6b; Hsd3b6; Hsd3b3; Ldhb; Rdh14; Rdh8; Cyp4f18; Uevld; Dhrs3; H6pd; Hsd17b14; Adh4; Adhfe1; Hsd3b7"
"GOMF_OXIDOREDUCTASE_ACTIVITY_ACTING_ON_PAIRED_DONORS_WITH_INCORPORATION_OR_REDUCTION_OF_MOLECULAR_OXYGEN_NAD_P_H_AS_ONE_DONOR_AND_INCORPORATION_OF_ONE_ATOM_OF_OXYGEN",0.316666666666667,0.931209150326797,0.107972360317345,0.364102668073951,1.12486679945798,19,"Cyp2d9; Cyp2d40; Akr1d1; Cyp2d26; Mical1; Akr1cl; Cyp4f18; Fmo5"
"GOMF_OXIDOREDUCTASE_ACTIVITY_ACTING_ON_THE_ALDEHYDE_OR_OXO_GROUP_OF_DONORS",0.485169491525424,0.931209150326797,0.0838361057159929,0.247461155226024,0.964149969201752,45,"Aox3; Aldh3b2; Aldh6a1; Aldh2; Aldh1a1; Aldh9a1; Aldh18a1; Akr1cl; Pdhx"
