"pathway","pval","padj","log2err","ES","NES","size","leadingEdge"
"GOMF_OLFACTORY_RECEPTOR_ACTIVITY",1.49931877299628e-05,0.00833621237785933,0.593325476396405,0.408929538170082,1.97206223291519,138,"Or4e2; Or4b13; Or3a1b; Or6d15; Or4k35; Or5b21; Or51a43; Or10g3; Or4k36; Or6d12; Or1e21; Or2ag15; Or13a18; Or6d14; Or5bb10; Or13l2; Or51a42; Or2ak7; Or2y1g; Or2ag18; Or2y1b; Or52r1; Or13a19; Or10s1; Or9q2; Or6b13; Or13c7d; Or52s19; Or8b56; Or10d5; Or11g27; Or10am5; Or6d13; Or1m1; Or4c119; Or10j5; Or2t44; Or8s5; Or13a28; Or6f2; Or2ak4; Or51h7; Or52b2; Or52x1; Or2k2; Or6c1b; Or8b8; Or52n4; Or52a5; Or2ag2b; Or55b10; Or10d5j; Or6z6; Or1f19; Or10g1; Or8c20; Or51k2"
"GOMF_CALCIUM_DEPENDENT_PROTEIN_BINDING",0.000513642476831561,0.142792608559174,0.477270815362862,0.489719196415101,1.92404537725228,46,"Anxa3; Stx2; Anxa11; Vamp2; Mgp; Tnnc1; Pef1; Anxa1; Syt6; Tnni3; Pdcd6; S100b; Slc9a1; Myo1d; Cd177; S100a7a; Syt8; Syn1"
"GOMF_LIPASE_ACTIVITY",0.00219365181627614,0.406556803283178,0.431707695803346,-0.409952343597658,-1.77508682198995,76,"Gdpd3; Ces1d; Pla2g2e; Pnpla8; Pla2g3; Hmox1; Plch2; Plce1; Pld3; Pgap6; Proca1; Daglb; Pld1; Pld6; Pla2g12a; Plcb1; Aspg; Plb1; Smpd2; Lipi; Abhd12; Ccl5; Smpdl3a; Pla2g2a; Lypla1; Plcg1; Abhd2; Pla2g2d; Ces1a; Smpd4; Abhd6"
"GOMF_PHOSPHOLIPASE_ACTIVITY",0.0047256738796256,0.656868669267958,0.407017918923954,-0.41907199539353,-1.76916250446554,65,"Gdpd3; Pla2g2e; Pnpla8; Pla2g3; Hmox1; Plch2; Plce1; Pld3; Pgap6; Proca1; Pld1; Pld6; Pla2g12a; Plcb1; Aspg; Plb1; Smpd2; Lipi; Abhd12; Ccl5; Smpdl3a; Pla2g2a; Lypla1; Plcg1; Pla2g2d; Smpd4; Abhd6"
"GOMF_PHOSPHATIDYLINOSITOL_3_KINASE_BINDING",0.00596720989241693,0.663553740036763,0.407017918923954,0.501070115217734,1.70164041288073,26,"Pik3ap1; Lck; Fyn; Igf1r; Pik3r1; Flt3; Hcst; Coro1a; Ptpn13; Cd2ap"
"GOMF_CALCIUM_CHANNEL_ACTIVITY",0.0090156080653904,0.664384552769441,0.380730400722792,0.392236423731297,1.62097845458787,55,"Trpm7; Cacna1a; Sec61a1; Cacng4; Cacna1d; Htr1b; Pkd1l3; Slc24a1; Catsper4; Ryr3; Itgav; Trpm4; Tpcn2; Trpv1; Nalf1; Pkdrej; Grin3b; Grin2d"
"GOMF_MONOATOMIC_CATION_CHANNEL_ACTIVITY",0.011949362459882,0.664384552769441,0.380730400722792,0.290746168915232,1.42523404705563,155,"P2rx5; Trpm7; Kcna2; Asic2; Cacna1a; Kcnb2; Asic4; Kcnq1; Kcnk2; Sec61a1; Cacng4; Chrnb4; Cacna1d; Cngb3; Htr1b; Kcnk13; Pkd1l3; Slc24a1; Kcnh6; Kcnj6; Kcnc2; Scn8a; Catsper4; Cngb1; Abcc8; Asic5; Ryr3; Scn5a; Itgav; Trpm4; Tpcn2; Trpv1; Nalf1; Atp5pf; Pkdrej; P2rx3; Grin3b; Grin2d; Atp5po; Scn7a; Grik4; Kcnma1; Kcnmb2; Lrrc26; Lrrc55; Kcnj11; Kcns3; Cacnb3; Cacng7; Cacnb4; Cacna1i; Atp5f1d; Trpm3; Piezo1; Htr3b; Hcn4; Abcc9; Chrne; Pkd2l2"
"GOMF_ODORANT_BINDING",0.00736923005125473,0.664384552769441,0.407017918923954,0.483960167471799,1.77563201757509,33,"Or4e2; Or5b21; Or13a18; Or5bb10; Or13l2; Or13a19; Or9q2; Or8b56; Or8s5; Or13a28"
"GOMF_OXIDOREDUCTASE_ACTIVITY_ACTING_ON_A_SULFUR_GROUP_OF_DONORS",0.011468359299641,0.664384552769441,0.380730400722792,-0.476671930723471,-1.66168907083915,29,"Dld; Selenot; Pcyox1; Ifi30; Txnrd1; Sqor; Txndc5; Pdia4; Tmx1; Msrb2; Tmx3; Txndc12; Gsto2"
"GOMF_WNT_PROTEIN_BINDING",0.0104809629636682,0.664384552769441,0.380730400722792,-0.53916325109181,-1.67504676661705,19,"Nid1; Fzd8; Fzd5; Ror2; Fzd4; Fzd10; Frzb; Fzd9; Fzd1; Trabd2b; Sfrp2; Fzd7"
"GOMF_ACETYLTRANSFERASE_ACTIVITY",0.0603210789644649,0.666919191919192,0.321775918075361,-0.344652113622907,-1.42392740622377,60,"Sat1; Hgsnat; Naa30; Naa50; Ncoa3; Acat2; Gnpnat1; Acat1; Taf1; Kat14; Nags; Acaa2"
"GOMF_ACYLTRANSFERASE_ACTIVITY_TRANSFERRING_GROUPS_OTHER_THAN_AMINO_ACYL_GROUPS",0.0473693498663156,0.666919191919192,0.321775918075361,-0.282679410425118,-1.34381924252766,123,"Gpat3; Sat1; Hgsnat; Zdhhc13; Osgep; Naa30; Naa50; Ncoa3; Acat2; Gnpnat1; Zdhhc16; Acat1; Sptlc2; Taf1; Kat14; Nags; Agpat5; Acaa2; Elovl6; Mboat7; Mcat; Elovl1; Aspg; Cln5; Slc27a3; Glul; Alas2; Zdhhc17; Zdhhc23; Acat3; Clock"
"GOMF_ANTIGEN_BINDING",0.0538302277432712,0.666919191919192,0.282013350011725,0.390577426256698,1.43414241425918,34,"H2-T23; H2-Oa; Lck; H2-Q1; Ep300; Tap1; H2-Q4; Sirpa; H2-K1; Psap; Cd40"
"GOMF_ATP_DEPENDENT_ACTIVITY_ACTING_ON_RNA",0.0473484848484848,0.666919191919192,0.287857117255149,-0.380904241591972,-1.46693516369072,44,"Dhx33; Ddx52; Zcwpw2; Ddx46; Ddx27; Ddx21; Ddx10; Ythdc2; Ddx3y; Ddx54; Tdrd12; Ddx11; Dhx37; Rigi"
"GOMF_CALCIUM_ION_BINDING",0.0505050505050505,0.666919191919192,0.287857117255149,-0.231713546843768,-1.24929057452858,337,"Sgca; Calml4; Crtac1; Pla2g2e; Spock2; Sdf4; Stim1; Nid2; Itgb1; Pls3; Nid1; Chp2; Dlk2; Plch2; Slit3; Cdh4; Sri; Ihh; Capn2; Calm4; Efcab10; Ccbe1; Fat3; Glce; Syt3; Capsl; Calu; Fat4; Efcab7; Try4; Rph3a; Efemp1; Notch2; Prkcsh; Chordc1; Plscr3; Pla2g12a; Prss1l; Prss2; Efcab3; Syt5; Tpt1; Micu3; Efcab9; Myl6; Fkbp7; Fstl4; Sparcl1; Plcb1; Atp2b2; Ehd1; Asah2; Gas6; Myl10; Hmcn1; Adgre5; Ehd4; Anxa5; Tbc1d8b; Unc13b; Fstl1; Gnptab; Proc; Calr4; Cacna1b; Creld1; Ttyh2; Pla2g2a; Ldlr; Prf1; Tpd52; Syt4; Aoc1l2; Myl6b; Pclo; Plcg1; Cabp2; Egf; Acer3; Necab3; Oit3; Hspg2; Slc25a24; Reps2; Slc25a23; Jag1; C2cd5; Tbc1d9b; Pla2g2d; Colec11; Epdr1; Ppp3r2; Ninl; Cetn4"
"GOMF_CALCIUM_ION_TRANSMEMBRANE_TRANSPORTER_ACTIVITY",0.0178845726558918,0.666919191919192,0.352487857583619,0.361090602793665,1.55050245337294,66,"Trpm7; Atp2b4; Cacna1a; Sec61a1; Cacng4; Cacna1d; Htr1b; Pkd1l3; Slc24a1; Catsper4; Ryr3; Itgav; Trpm4; Tpcn2; Trpv1; Nalf1; Pkdrej; Grin3b; Grin2d"
"GOMF_CARBOXYLIC_ESTER_HYDROLASE_ACTIVITY",0.0301268852235948,0.666919191919192,0.352487857583619,-0.319588011173071,-1.41413737133218,88,"Gdpd3; Ces1d; Pla2g2e; Pnpla8; Pla2g3; Lyplal1; Pgap6; Proca1; Iars2; Daglb; Vars1; Acot10; Pla2g12a; Aspg; Plb1; Lars1; Esd; Abhd12; Pon2; Ndst3; Ndst2; Pgap1; Pla2g2a; Lypla1; Acot12; Aars1; Abhd2; Pla2g2d; Ces1a; Abhd6; Ptrh2"
"GOMF_CARGO_RECEPTOR_ACTIVITY",0.0664136622390892,0.666919191919192,0.241339976815091,-0.376438596768729,-1.4108374882821,40,"Tmed6; Lrp10; Folr1; Tmed3; Abca1; Cxcl16"
"GOMF_CATALYTIC_ACTIVITY_ACTING_ON_A_NUCLEIC_ACID",0.0303096135404934,0.666919191919192,0.352487857583619,-0.234226967229975,-1.27927344629761,367,"Mblac1; Polr3a; Dclre1c; Dhx33; Ddx52; Pop4; Eme1; Prorp; Btaf1; Nav2; Zcwpw2; Poll; Tsr3; Ddx46; Mus81; Ino80; Ogg1; Exog; Prim1; Aplf; Eri1; Smarca1; Dars2; Ddx27; Fbl; Rad9a; Pld3; Mettl5; Ddx21; Iars2; Dkc1; Mettl16; Alkbh2; Nudt16; Tsnax; Vars1; Smarca5; Ddx10; Nsun3; Dis3l; Pld6; Spo11; Ercc3; Msh4; Ythdc2; Mlh1; Ankzf1; Dclre1a; Xrcc6; Tdp2; Nsun5; Xrn2; Dnmt3b; Ddx3y; Smarca2; Hfm1; Pgbd5; Trmt12; Trmt10a; Chd4; Polr3b; Dus2; Lars1; Ddx54; Thg1l; Ftsj1; Trmt44; Tdrd12; Ddx11; Kars1; Dhx37; Rfc2; Mcm5; Mettl3; Npm2; Rigi; Rpp14; Ung; Lactb2; Rad50; Fen1; Dus4l; Mettl1; Twnk; Dscc1; Exd2; Msh5; Mrm1; Rps3; Ruvbl1; Top2b; Rnaseh1; Polr2j; Ern1; Rbbp4; Mars2; Tars1; Aars1; Tyw1; Trmt10b; Rnasek; Exo1; Jmjd6; Pus3; Dbr1; Cars2; Ptges3; Ddx50; Ggt5; Cmtr2; Dhx57; Ptrh2; Ttf2; Atrx; Rpp21; Tep1; Poli; Rtel1; Thumpd3"
"GOMF_COPPER_ION_BINDING",0.0400294373152805,0.666919191919192,0.321775918075361,0.411364338260728,1.52497885370364,36,"Or4e2; Aoc1; Snca; Sncb; Pam; Loxl4; F5; Atox1; Cox11"
"GOMF_CYCLIN_BINDING",0.048828125,0.666919191919192,0.287857117255149,-0.461380986847714,-1.51983719189294,24,"Cdk6; Ndc80; Proca1; Tnfaip1; Inca1; Xrcc6; Cdk13; Rack1; Hdac3; Cdk1; Cdk5rap3; Gak"
"GOMF_DISULFIDE_OXIDOREDUCTASE_ACTIVITY",0.0652591170825336,0.666919191919192,0.245041785430996,-0.469997176052702,-1.49768561806783,21,"Selenot; Ifi30; Txnrd1; Txndc5; Pdia4; Tmx1; Tmx3; Txndc12; Gsto2"
"GOMF_DNA_SECONDARY_STRUCTURE_BINDING",0.0547556530977555,0.666919191919192,0.321775918075361,0.458906587264537,1.49857025861711,23,"Abl1; Pot1a; Rad51d; Rad51b; Pot1b; Hmgb1; Msh2; Neil3; Hmg20b; Gen1"
"GOMF_EXOGENOUS_PROTEIN_BINDING",0.0204405878817508,0.666919191919192,0.352487857583619,-0.506235044485155,-1.5927660801901,20,"Siva1; Bsg; Cd81; Cd55; Pvr; Slc7a1"
"GOMF_EXONUCLEASE_ACTIVITY",0.0225688641634986,0.666919191919192,0.352487857583619,-0.383464768213441,-1.50599936361942,49,"Dclre1c; Exd1; Exog; Aplf; Eri1; Rad9a; Pld3; Rexo5; Alkbh2; Dis3l; Dclre1a; Xrn2"
"GOMF_EXTRACELLULAR_MATRIX_STRUCTURAL_CONSTITUENT_CONFERRING_TENSILE_STRENGTH",0.0340703950602374,0.666919191919192,0.321775918075361,0.429435544321181,1.45836850921915,26,"Col11a2; Col25a1; Col7a1; Col4a5; Col13a1; Col6a6"
"GOMF_FLAVIN_ADENINE_DINUCLEOTIDE_BINDING",0.0684410646387833,0.666919191919192,0.237793834423688,-0.327190434520499,-1.35178462093446,60,"Dld; Coq6; Etfa; Aifm3; Pcyox1; Acadsb; Maob; Dpyd; Por; Aifm1; Txnrd1; Mto1; Acox1; Dus2; Gcdh; Aox4; Acadvl; Sqor; Sardh; Dus4l; Cyb5r1; Nos3; Fmo2; Steap4"
"GOMF_GATED_CHANNEL_ACTIVITY",0.0670826297161135,0.666919191919192,0.287805130535564,0.268734225296319,1.31505770630999,151,"P2rx5; Kcna2; Clcnkb; Asic2; Cacna1a; Cftr; Kcnb2; Asic4; Kcnq1; Kcnk2; Cacng4; Chrnb4; Slc1a5; Cacna1d; Cngb3; Htr1b; Kcnk13; Kcnh6; Kcnj6; Kcnc2; Gabre; Catsper4; Cngb1; Asic5; Ryr3; Ano2; Itgav; Trpm4; Tpcn2; Trpv1; Nalf1; P2rx3; Grin3b; Grin2d; Ttyh3; Clcn7; Scn7a; Grik4; Kcnma1; Kcnmb2; Lrrc26; Lrrc55; Kcnj11; Kcns3; Cacnb3; Cacng7; Tmc3; Pacc1; Cacnb4; Cacna1i; Piezo1; Htr3b; Hcn4; Chrne; Atp5mc1"
"GOMF_HELICASE_ACTIVITY",0.0477099236641221,0.666919191919192,0.287857117255149,-0.313483674036766,-1.38712643547143,88,"Dhx33; Ddx52; Nav2; Zcwpw2; Ddx46; Smarca1; Ddx27; Ddx21; Smarca5; Ddx10; Ercc3; Ythdc2; Xrcc6; Ddx3y; Smarca2; Hfm1; Chd4; Ddx54; Tdrd12; Ddx11; Dhx37; Rfc2; Mcm5; Rigi; Rad50; Twnk; Dscc1; Ruvbl1"
"GOMF_HISTONE_BINDING",0.0350519845808021,0.666919191919192,0.321775918075361,-0.27706572885976,-1.35278821585386,148,"Cbx3; Rrp8; Pih1d1; Zcwpw2; Sap30l; Rbbp7; Stat1; Ino80; Aplf; Rnf8; Usp16; Lrwd1; Ttll12; Zmynd11; Cks2; Tonsl; Taf1; Anp32a; Lef1; Asf1a; Smarca5; Prmt6; Sfmbt1; L3mbtl3; Smarca2; Cbx5"
"GOMF_HISTONE_H3_METHYLTRANSFERASE_ACTIVITY",0.051440329218107,0.666919191919192,0.287857117255149,0.45810878976339,1.49596503210523,23,"Carm1; Kmt2b; Smyd3; Setd1b; Setd1a; Dot1l; Setmar; Setd3; Suv39h1; Ehmt2; Suv39h2; Mettl23"
"GOMF_HYDROLASE_ACTIVITY_ACTING_ON_CARBON_NITROGEN_BUT_NOT_PEPTIDE_BONDS_IN_LINEAR_AMIDES",0.0616570327552987,0.666919191919192,0.252961123069611,-0.349499848400501,-1.40447874543198,55,"Asah1; Aga; Hint3; Ngly1; Fhit; Klk1b21; Mier2; Klk1b22; Aspg; Asah2; Hdac1; Ndst3; Cat; Ndst2; Hdac3; Hdac2; Klk1b4; Acer3"
"GOMF_HYDROLASE_ACTIVITY_ACTING_ON_ESTER_BONDS",0.0523138832997988,0.666919191919192,0.282013350011725,-0.216006117711165,-1.20168854493103,434,"Pde7a; Bpnt2; Gdpd3; Mblac1; Ces1d; Pla2g2e; Pnpla8; Dclre1c; Exd1; Ppp1r3e; Pop4; Eme1; Ptprv; Prorp; Inpp5f; Pla2g3; Hmox1; Mus81; Bckdk; Plch2; Exog; Lyplal1; Aplf; Ptp4a2; Eri1; Samhd1; Nt5e; Plce1; Rad9a; Pld3; Pgap6; Them4; Ilkap; Proca1; Las1l; Iars2; Daglb; Rexo5; Plppr4; Alkbh2; Acot13; Nudt16; Tsnax; Vars1; Pld1; Acot10; Dis3l; Pld6; Acaa2; Ankzf1; Dclre1a; Ubash3b; Tdp2; Hddc3; Pla2g12a; Xrn2; Dusp16; Pgbd5; Acp4; Ppm1l; Ptprs; Plpp6; Cdc25a; Plcb1; Aspg; Cln5; Nt5dc1; Plb1; Lars1; Smpd2; Psph; Esd; Lipi; Ctdsp2; Trir; Abhd12; Bpnt1; Dusp1; Dusp18; Pon2; Pxylp1; Adprm; Ndst3; Ccl5; Rpp14; Smpdl3a; Lactb2; Rad50; Timm50; Ndst2; Mtm1; Pgap1; Fen1; Dusp12; Pla2g2a; Ppm1k; Exd2; Abhd17a; Rps3; Lhpp; Rnaseh1; Ern1; Lypla1; Abhd13"
"GOMF_INTRAMEMBRANE_LIPID_TRANSPORTER_ACTIVITY",0.0584795321637427,0.666919191919192,0.261663521711573,-0.432327989396653,-1.48573329921195,28,"Abca1; Atp9a; Xkr4; Atp8a1; Plscr3; Atp10b; Ano7; Ano5; Atp11c; Ano10; Atp10d; Tmem41b; Plscr1l1; Xkr8; Abcb1a"
"GOMF_INTRAMOLECULAR_OXIDOREDUCTASE_ACTIVITY",0.0660194174757282,0.666919191919192,0.245041785430996,-0.399027417682105,-1.42490572875053,32,"Echs1; Ebp; Ebpl; Mif; Ddt; Tbxas1; Txndc5; Creld1; Pdia4; Erp27; Tmx1; Tmx3; Ptges3; Tpi1; Hyi"
"GOMF_LIGAND_GATED_MONOATOMIC_CATION_CHANNEL_ACTIVITY",0.0265185045893537,0.666919191919192,0.352487857583619,0.37785646899316,1.55617275093823,53,"P2rx5; Asic2; Asic4; Chrnb4; Cngb3; Kcnh6; Kcnj6; Catsper4; Cngb1; Asic5; Ryr3; Trpm4; Tpcn2; Trpv1; P2rx3; Grin2d; Grik4; Kcnma1; Kcnmb2"
"GOMF_MAGNESIUM_ION_BINDING",0.0584795321637427,0.666919191919192,0.261663521711573,-0.271582658711041,-1.30192506330767,135,"Comt; Prps2; Polr3a; Itgb1; Pgm3; Prim1; Ran; Wnk1; Atp9a; Nudt16; Atp8a1; Cdc42bpa; Srpk1; Dck; Gck; Rps6ka3; Morc2b; Tdp2; Plscr3; Hprt1; Atp10b; Xylt2; Arl3; Lrrk2; Gtpbp10; Thg1l; Glul; Psph; Bpnt1; Map3k6; Rap2a; Atp11c; Pklr; Fen1; Rps6ka4; Uba2; Atp10d; Gnai1; Exd2; Rnaseh1; Ern1"
"GOMF_METAL_ION_TRANSMEMBRANE_TRANSPORTER_ACTIVITY",0.048720529490336,0.666919191919192,0.321775918075361,0.245521034955886,1.26623410836182,216,"Trpm7; Kcna2; Asic2; Atp2b4; Cacna1a; Slc6a20a; Kcnb2; Atp1b2; Asic4; Slc9a5; Kcnq1; Slc30a6; Kcnk2; Slc38a2; Sec61a1; Cacng4; Slc6a18; Cacna1d; Htr1b; Kcnk13; Slc34a3; Slc1a3; Pkd1l3; Slc24a1; Kcnh6; Kcnj6; Kcnc2; Slc39a7; Slc5a2; Scn8a; Slc9c1; Catsper4; Slc5a5; Abcc8; Asic5; Ryr3; Slc6a11; Scn5a; Itgav; Trpm4; Tpcn2; Trpv1; Nalf1; Pkdrej; Atp1a2; Slc9a1; Slc39a8; Grin3b"
"GOMF_NAD_BINDING",0.0530785562632696,0.666919191919192,0.287857117255149,0.377661917302947,1.45217439918298,42,"Aox3; Hadh; Hsd11b2; Aldh2; Phgdh; Idh1; Aldh1a1; Ugdh; Cyb5r3; Aldh9a1"
"GOMF_NUCLEAR_ANDROGEN_RECEPTOR_BINDING",0.0706106870229008,0.666919191919192,0.234392647294686,-0.492582845903885,-1.46810378589302,17,"Ncoa3; Foxp1; Psmc3ip; Tmf1; Kdm4c; Rnf6; Trim68; Prmt2; Prpf6; Daxx; Foxp2"
"GOMF_NUCLEASE_ACTIVITY",0.0702329795004779,0.666919191919192,0.287805130535564,-0.289561253835366,-1.35292536159394,115,"Mblac1; Dclre1c; Exd1; Pop4; Eme1; Prorp; Mus81; Exog; Aplf; Eri1; Rad9a; Pld3; Las1l; Rexo5; Alkbh2; Nudt16; Tsnax; Dis3l; Pld6; Ankzf1; Dclre1a; Tdp2; Xrn2"
"GOMF_N_ACETYLTRANSFERASE_ACTIVITY",0.071969696969697,0.666919191919192,0.231126709673834,-0.3623411700031,-1.39544522084836,44,"Sat1; Hgsnat; Naa30; Naa50; Ncoa3; Gnpnat1; Taf1; Kat14; Nags"
"GOMF_OXIDOREDUCTASE_ACTIVITY_ACTING_ON_THE_CH_NH_GROUP_OF_DONORS",0.0188176578611011,0.666919191919192,0.352487857583619,0.534592019378676,1.70514645314928,21,"Aass"
"GOMF_PASSIVE_TRANSMEMBRANE_TRANSPORTER_ACTIVITY",0.0541082164328657,0.666919191919192,0.276500599254472,0.241556385172677,1.25700378803672,238,"P2rx5; Trpm7; Kcna2; Clcnkb; Asic2; Cacna1a; Aqp5; Cftr; Kcnb2; Gje1; Asic4; Kcnq1; Kcnk2; Sec61a1; Cacng4; Chrnb4; Slc1a5; Mpeg1; Cacna1d; Cngb3; Htr1b; Kcnk13; Pkd1l3; Slc24a1; Kcnh6; Kcnj6; Kcnc2; Scn8a; Slc9c1; Gabre; Catsper4; Cngb1; Bcl2; Abcc8; Asic5; Ryr3; Ano2; Scn5a; Itgav; Trpm4; Clic1; Mcl1; Tpcn2; Gjd3; Trpv1; Nalf1; Atp5pf; Pkdrej; P2rx3; Grin3b; Tmem120a; Grin2d; Atp5po; Ttyh3; Clcn7; Scn7a; Grik4; Kcnma1; Kcnmb2; Lrrc26; Lrrc55; Kcnj11; Slc12a7; Kcns3; Cacnb3; Cacng7; Lrrc8a; Tmc3; Pacc1; Slc17a8; Cacnb4; Cacna1i; Atp5f1d; Trpm3; Piezo1; Apol8; Htr3b; Hcn4; Abcc9; Chrne; Pkd2l2; Atp5mc1"
"GOMF_PEPTIDASE_REGULATOR_ACTIVITY",0.0679611650485437,0.666919191919192,0.241339976815091,-0.276138708191465,-1.3008054062066,119,"Ctsh; Apaf1; Serpini1; Psme2; Wfikkn2; Cst8; Rps27l; Tfpi2; Xiap; Itih2; Timp3; Cast; Cstdc1; Bcl10; Tfpi; Wfdc5; Lxn; Acrbp; Wfdc17; Birc5; Cflar; Spink4; Lgmn; Rack1; Cst9; Wfdc3; Cav1; Rarres1; Wfdc1; Timm50; Aph1c; Ctss; Serpinb6b; Rock1; Eppin; Crim1"
"GOMF_PEPTIDE_ANTIGEN_BINDING",0.0576131687242798,0.666919191919192,0.271288554688953,0.457736058348821,1.44015910933722,20,"H2-T23; H2-Oa; H2-Q1; Tap1; H2-Q4; H2-K1; Dhcr24; H2-Eb1; H2-T10"
"GOMF_PHOSPHATIDYLINOSITOL_3_4_5_TRISPHOSPHATE_BINDING",0.0617283950617284,0.666919191919192,0.261663521711573,0.399726774672163,1.42351740296527,30,"Plekhb2; Nrgn; Asap1; Fermt2; Dnm1; Fchsd2"
"GOMF_PHOSPHORIC_DIESTER_HYDROLASE_ACTIVITY",0.0569744597249509,0.666919191919192,0.266350657088526,-0.363400532273371,-1.40507556986049,47,"Pde7a; Gdpd3; Hmox1; Plch2; Plce1; Pld3; Pld1; Pld6; Tdp2; Plcb1; Smpd2; Adprm; Ccl5; Smpdl3a"
"GOMF_PHOSPHOTYROSINE_RESIDUE_BINDING",0.0644490644490645,0.666919191919192,0.257206466468838,0.411500039955814,1.39745931083233,26,"Abl1; Hck; Lck; Shb; Pik3r1; Grb2"
"GOMF_PROTEIN_CARRIER_CHAPERONE",0.0658914728682171,0.666919191919192,0.245041785430996,-0.444309939681272,-1.45099148052856,23,"Emc2; Aplf; Asf1a; Mmgt1; Mtch1; Dusp16; Pex5"
"GOMF_PROTEIN_FOLDING_CHAPERONE",0.0717299578059072,0.666919191919192,0.245041785430996,0.376630191155331,1.42099049386758,39,"Hspa8; Ccdc47; Wdr83os; Cct6b; Hypk; Cct4; Dnajb8; Dffa; Dnajb6; Hspb6; Cct6a; Pdcl3; Hspa1a; Dnajb3; Khsrp"
"GOMF_PROTEIN_LYSINE_N_METHYLTRANSFERASE_ACTIVITY",0.0576131687242798,0.666919191919192,0.271288554688953,0.406786079009236,1.44865718146746,30,"Kmt2b; Smyd3; Setd1b; Setd1a; Dot1l; Setmar; Vcpkmt; Camkmt; Atpsckmt; Setd3; Suv39h1; Ehmt2; Suv39h2; Mettl23"
"GOMF_PROTEIN_MEMBRANE_ADAPTOR_ACTIVITY",0.0484496124031008,0.666919191919192,0.287857117255149,-0.430911911868799,-1.50216861597035,29,"Lamtor1; Sun3; Syne1; Get1; Atg2a; Prima1; Myh9; Atg2b"
"GOMF_PROTON_TRANSMEMBRANE_TRANSPORTER_ACTIVITY",0.0619136960600375,0.666919191919192,0.248911114434702,-0.307514343686973,-1.34422655606723,84,"Atp6v0e2; Slc45a3; Slc9a6; Slc9a2; Slc46a1; Slc2a13; Slc25a4; Atp5pb; Slc25a27; Ndufa2; Ndufs7; Atp6v0e; Atp6v0a2; Atp5f1e; Ndufs3; Ctns; Slc2a4; Ndufs2; Uqcrfs1; Atp6v1b2; Slc25a5; Slc17a7; Tmco3; Atp5mg"
"GOMF_SODIUM_ION_TRANSMEMBRANE_TRANSPORTER_ACTIVITY",0.0589473684210526,0.666919191919192,0.271288554688953,0.315143741706622,1.36605927726608,72,"Asic2; Slc6a20a; Atp1b2; Asic4; Slc9a5; Slc38a2; Slc6a18; Slc34a3; Slc1a3; Slc24a1; Slc5a2; Scn8a; Slc9c1; Slc5a5; Asic5; Slc6a11; Scn5a; Tpcn2; Atp1a2; Slc9a1; Scn7a; Slc34a1; Grik4"
"GOMF_STRUCTURAL_CONSTITUENT_OF_RIBOSOME",0.0172848324460934,0.666919191919192,0.352487857583619,-0.299975117667441,-1.43300869971233,126,"Mrpl19; Mrpl14; Rps5; Mrps18c; Mrpl35; Rpsa; Rps20; Rpl39; Rpl36a; Rps27l; Rps27a; Rpl10; Mrpl17; Rpl27; Rps27; Rps29; Rpl18; Mrpl22; Rpl6; Mrpl3; Rpl27a; Mrpl18; Uba52; Ndufa7; Rpl10l; Rps7; Mrpl4; Mrps16; Mrpl52; Mrpl11; Rps8; Rps13; Rpl35a; Mrps23; Rps3; Mrps31; Rpl3; Mrpl46; Imp3; Mrps30; Rps17; Rpl26; Mrpl41; Rps19; Rps12"
"GOMF_TRANSFERASE_ACTIVITY_TRANSFERRING_ALKYL_OR_ARYL_OTHER_THAN_METHYL_GROUPS",0.0579439252336449,0.666919191919192,0.257206466468838,-0.379082892200478,-1.43485600666379,41,"Gsta4; Tsr3; Pdss1; Dph2; Gstm7; Trmt12; Cox10; Ggps1; Fnta; Fdft1; Hmbs; Sms; Coq2; Nus1; Gsto2; Gstt1; Rabggtb; Gstm2"
"GOMF_UNFOLDED_PROTEIN_BINDING",0.0579710144927536,0.666919191919192,0.271288554688953,0.336186647388451,1.40509992503375,57,"Hspa8; Cct6b; Dnajb11; Ern2; Canx; Cct4; Dnajb8; Tbce; Pfdn4; Dnajb6; Serpinh1; Hspb2; Uggt1; Dnaja1; Hspb6; Scg5; Cct6a; Ssu2; Hspa1a; St13; Srsf10; Dnajb3"
"GOMF_VITAMIN_B6_BINDING",0.0658914728682171,0.666919191919192,0.245041785430996,-0.418773646345319,-1.45985434936627,29,"Gpt2; Oat; Sgpl1; Sptlc2; Thnsl2; Plpbp; Alas2; Cth; Psat1; Gadl1; Kyat3; Pygb; Kyat1"
"GOMF_VOLTAGE_GATED_CHANNEL_ACTIVITY",0.0630252100840336,0.666919191919192,0.261663521711573,0.301820443435867,1.34952886641069,87,"P2rx5; Kcna2; Clcnkb; Cacna1a; Kcnb2; Kcnq1; Kcnk2; Cacng4; Cacna1d; Htr1b; Kcnk13; Kcnh6; Kcnj6; Kcnc2; Catsper4; Itgav; Trpm4; Tpcn2; Grin3b; Grin2d; Clcn7; Kcnma1; Lrrc26; Lrrc55; Kcnj11; Kcns3; Cacnb3; Cacng7"
"GOMF_5_3_EXONUCLEASE_ACTIVITY",0.0803921568627451,0.667134913666959,0.222056046145248,-0.506050942948984,-1.43956469020305,15,"Dclre1c; Exog; Pld3; Dclre1a; Xrn2; Trir; Fen1; Exo1"
"GOMF_CATALYTIC_ACTIVITY_ACTING_ON_DNA",0.0772200772200772,0.667134913666959,0.224966093540314,-0.260518806000799,-1.26656215084883,147,"Dclre1c; Eme1; Btaf1; Nav2; Poll; Mus81; Ino80; Ogg1; Exog; Aplf; Smarca1; Rad9a; Pld3; Dkc1; Alkbh2; Smarca5; Spo11; Ercc3; Msh4; Mlh1; Dclre1a; Xrcc6; Tdp2; Dnmt3b; Smarca2; Hfm1; Pgbd5; Chd4; Ddx11; Rfc2; Mcm5; Npm2; Ung; Rad50; Fen1; Twnk; Dscc1; Exd2; Msh5; Rps3; Ruvbl1; Top2b"
"GOMF_INTEGRIN_BINDING",0.0794573643410853,0.667134913666959,0.222056046145248,-0.288415112357788,-1.28273898838429,92,"Tspan8; Itgb1; Cd81; Lamb2; Ccn4; Jam3; Mfge8; Ccn2; Itgbl1; Tspan4; Ccn1; Adam9; Src; S1pr3; Igf2; Sema7a; Myh9"
"GOMF_LIGAND_GATED_CHANNEL_ACTIVITY",0.0780590717299578,0.667134913666959,0.234392647294686,0.308182498372944,1.34533705447449,75,"P2rx5; Asic2; Cftr; Asic4; Chrnb4; Slc1a5; Cngb3; Kcnh6; Kcnj6; Gabre; Catsper4; Cngb1; Asic5; Ryr3; Ano2; Trpm4; Tpcn2; Trpv1; P2rx3; Grin3b; Grin2d; Ttyh3; Grik4; Kcnma1; Kcnmb2"
"GOMF_PROTEIN_PHOSPHATASE_BINDING",0.0770863613745689,0.667134913666959,0.287805130535564,0.284839878635595,1.3404605759171,115,"Atp2b4; Vrk3; Tmem225; Ppp1r3d; Ambra1; Kcnq1; Lck; Stat6; Kat2a; Pik3r1; Dlg2; Map3k5; Bad; Cdc5l; Phactr4; Strn; Grb2; Gna12; Lgals3; Bcl2; Gtf2f1; Ppp1r9a; Mapk14; Ank1; Snx3; Sirpa; Cdh5; Cd22; Igbp1b; Slc9a1; Hsf4"
"GOMF_STRUCTURAL_MOLECULE_ACTIVITY",0.0748987854251012,0.667134913666959,0.234392647294686,-0.215555693161552,-1.19069435276102,407,"Mrpl19; Spock2; Camk2b; Mrpl14; Rps5; Nup62cl; Nid2; Mrps18c; Mrpl35; Cldn11; Rpsa; Hmox1; Pdlim3; Lama4; Pls3; Nid1; Crygs; Rps20; Tube1; Rpl39; Lamb2; Add3; Nup85; Spon1; Mfge8; Eppk1; Nexn; Rpl36a; Rps27l; Rps27a; Myh11; Mfap2; Rpl10; Lamc1; Mrpl17; Rpl27; Rps27; Cldn3; Hp1bp3; Rps29; Rpl18; Mrpl22; Efemp1; Copb2; Rpl6; Mrpl3; Krt31; Clta; Rpl27a; H2bc27; Mrpl18; Uba52; Insr; Dcn; Epb41l1; Ndufa7; Myl6; Rpl10l; Tubb6; Cldn13; Copa; Tpm2; Septin7; Rps7; Tpm1; Synm; Mrpl4; H2az1; Rims1; Actbl2; Hmcn1; Psmd13; Emid1; Mrps16; Mrpl52; H2bc14; Mrpl11; Rps8; Col9a3; Col14a1; Lama2; Rps13; Dbnl; Creld1; Tpr; H2ax; H4c9; Rpl35a; Mrps23; Krt75; Rps3; Cope; Mrps31; Rpl3; Rapsn; Myl6b; Pclo; Mrpl46; Krt42; Imp3; Mrps30; Gm5414; Crygc; Rps17; Crybb3; Hspg2; Nup155; Rpl26; H2az2"
"GOMF_UBIQUITIN_LIKE_PROTEIN_LIGASE_BINDING",0.0763052208835341,0.667134913666959,0.231126709673834,-0.2438540737844,-1.23502315807042,210,"Itch; Stat2; Ube2l3; Stat1; Rnf8; Fzd8; Rps27a; Nae1; Fhit; Cul9; Laptm5; Trip4; Smad2; Magec2; Axin1; Bcl10; Eif4e2; Txnip; Fzd5; Ubash3b; Hsp90ab1; Crk; Rala; Yod1; Uba52; Sorbs1; Cul7; Fzd4; Stub1; Ccdc50; Ube2a; Cul5; Ube2d3; Ndufs2; Ckb; Mul1; Cul2; Tsg101; Slc25a5; Jun; Prkar1a; Mid1; Derl1; Foxo1; Rigi; Spopfm2; Zfp746; Gpr37; Smc6; Gabarapl2; Trib3"
"GOMF_CYCLIN_DEPENDENT_PROTEIN_SERINE_THREONINE_KINASE_REGULATOR_ACTIVITY",0.0854368932038835,0.678613037447989,0.213927855492356,-0.385693546516941,-1.37729118256213,32,"Cks2; Cdkn2c; Ccnl1; Ccny; Inca1; Cdk5r2; Ccnq; Ccna1; Ccng2; Ccnh; Cnppd1; Ccnb3; Cks1b; Cdkn2d; Ccng1; Ccnd2; Cdkn1b; Ccno"
"GOMF_MOLECULAR_CARRIER_ACTIVITY",0.0834914611005693,0.678613037447989,0.213927855492356,-0.345922040152732,-1.35855602786949,49,"Emc2; Aplf; Zng1; Asf1a; Mmgt1; Disp1; Mtch1; Nubp1; Trf; Dusp16; Hikeshi; Eif4enif1; Nubp2; Pex5"
"GOMF_SODIUM_CHANNEL_ACTIVITY",0.0854166666666667,0.678613037447989,0.222056046145248,0.454456887969083,1.40400911579585,19,"Asic2; Asic4; Scn8a; Asic5; Scn5a; Tpcn2; Scn7a; Grik4; Cacna1i; Hcn4"
"GOMF_BHLH_TRANSCRIPTION_FACTOR_BINDING",0.0929791271347249,0.679098780780388,0.20207170902116,-0.432508108106681,-1.41254677898113,22,"Ascl1; Tcf15; Hand1; Sox9; Lmo2; Ube2i; Bmal1; Usf1; Bhlhe41; Usf2; Tcf4"
"GOMF_CYCLIC_NUCLEOTIDE_BINDING",0.0882956878850103,0.679098780780388,0.216542836735348,0.470836910987736,1.42722764476146,18,"Slc19a1; Cngb3; Pde4a; Pde5a; Cngb1; Pde6h; Cnbd2"
"GOMF_ENDONUCLEASE_ACTIVITY",0.0982986767485822,0.679098780780388,0.195789002148949,-0.300256390118253,-1.29194501887634,73,"Mblac1; Dclre1c; Pop4; Eme1; Prorp; Mus81; Exog; Aplf; Las1l; Alkbh2; Nudt16; Tsnax; Pld6; Ankzf1; Tdp2"
"GOMF_LIGASE_ACTIVITY",0.0956175298804781,0.679098780780388,0.204294756516886,-0.272907134301661,-1.25500366230972,108,"Pcca; Itch; Acsbg1; Acsl4; Dars2; Sae1; Ttll7; Nae1; Iars2; Atp5pb; Pccb; Vars1; Slc27a6; Suclg2; Uba1y; Atp5f1e; Aacs; Uba6; Gatc; Ttll3; Lars1; Slc27a3; Glul; Kars1; Acacb; Atp5mg; Uba2; Ppcs; Ifnar1; Mars2; Atg7; Tars1; Aars1; Adss1; Atp5mf; Cars2"
"GOMF_MHC_CLASS_I_PROTEIN_BINDING",0.0991902834008097,0.679098780780388,0.20207170902116,0.474020712686641,1.39806234282081,16,"H2-T23; H2-Q1; Cd8b1; Tap1; H2-Q4; H2-K1"
"GOMF_MHC_PROTEIN_BINDING",0.0926315789473684,0.679098780780388,0.213927855492356,0.428741027944271,1.37313225801901,22,"H2-T23; Marchf1; H2-Q1; Cd8b1; Tap1; Lag3; H2-Q4; H2-K1; Cyrib"
"GOMF_NADP_BINDING",0.106177606177606,0.679098780780388,0.190023305279108,-0.395709384275191,-1.3504530582657,27,"Grhpr; Lbr; G6pd2; Dpyd; Por; Akr1b8; Dus2; Cbr4; Cat; Nos3; G6pdx; Fmo2"
"GOMF_NON_MEMBRANE_SPANNING_PROTEIN_TYROSINE_KINASE_ACTIVITY",0.10625,0.679098780780388,0.197822021315103,0.393904308747005,1.32512254126893,25,"Abl1; Hck; Lck; Fyn; Txk; Peak1"
"GOMF_NUCLEOBASE_CONTAINING_COMPOUND_KINASE_ACTIVITY",0.106122448979592,0.679098780780388,0.195789002148949,0.401665818471228,1.33459444948521,24,"Ak2; Dguok; Pnkp; Nme3; Pck1; Ak1"
"GOMF_ORGANIC_CATION_TRANSMEMBRANE_TRANSPORTER_ACTIVITY",0.0991561181434599,0.679098780780388,0.206587922696891,0.345347900416619,1.34048661147471,44,"Slc29a3; Slc6a20a; Pou2f2; Slc22a4; Slc38a2; Slc1a5; Slc15a4; Slc44a5; Slc32a1; Sfxn3; Slc22a8; Slc47a2; Slc36a3"
"GOMF_PHOSPHOLIPASE_A2_ACTIVITY",0.102713178294574,0.679098780780388,0.193813302725311,-0.418616121311529,-1.36708268572759,23,"Pla2g2e; Pnpla8; Pla2g3; Pgap6; Proca1; Pla2g12a; Plb1"
"GOMF_PROTEIN_DISULFIDE_REDUCTASE_ACTIVITY",0.0916030534351145,0.679098780780388,0.204294756516886,-0.481706348048027,-1.43568725370514,17,"Selenot; Txnrd1; Txndc5; Pdia4; Tmx1; Tmx3; Txndc12"
